chapter_no,date,title,content
217,"September 30, 1913",LETTER TO “THE TRANSVAAL LEADER”libtech_446_footnote,"
  
 
 [JOHANNESBURG,]
 September 30, 1913
 
TO
 THE EDITOR
 THE TRANSVAAL LEADER
 
  SIR,     I trust that you will 	allow me to correct the many misrepresen- 
  	tations made by your reporter with reference to the passive 	resistance movement. No doubt they are not all consciously made, but 	he  certainly has been the instrument through which they have  been 	made. “The Indian Passive resistance campaign”, you have 	reported, “is threatened with collapse.” This statement will 	prove to be untrue even if there is one passive resister earnest 	enough to carry it on, and I prophesy that, so long as there is 	one-passive resister left to fight, the points we are now fighting 	for will be granted, not because of the strength of such solitary 	passive resister, but because of the invincible strength of the 	truth for which he may be fighting. That our demands are just you 	have admitted in your leading article, only you have asked us not to 	revive passive resistance, but to be patient and to petition. Which 	course is the better is a matter of opinion. I hold that the points 	at issue are to the community of such vital importance that passive 	resistance is the only remedy, petitions having failed.  	Now for facts. Your report states: “The Indian merchants 	throughout the Transvaal have dissociated themselves from the 	movement, and have withdrawn from Mr. Gandhi sources of revenue 	without which the campaign must fail:” The fact is that the great 	mass    
 meeting of Sundaylibtech_447_footnotelibtech_448_footnotewas attended by almost all the Indian merchants of Johannesburg, and telegrams in support of the objects of the meeting were received from all the principal towns of the Transvaal, sent by the Indian merchants of those places, anddelegates attended from the towns which could send them upon hardly 24 hours’ notice. If there is a split in the community, I assure you that it will not be because passive resisters are asking too much, but because they will be asking too little, for I admit that there are men amongst us who undoubtedly want passive resisters to go to the full length.  They cannot be held blameworthy, but they certainly will not represent the moderate wing. I do not know who the influential Mahomedan mer- chants are who gave your reporter the information that there is very little ground for complaint, and that those who attended the Gold Law Conference were against passive resistance. Your reporter is free to see the names in my possession of the principal merchants in the Trans- vaal who have expressed themselves heart and soul with the move- ment. It is true that they have not all offered to go to gaol, but they have certainly offered to help with their purses. But I need not carry any further the refutation of the misrepresentations contained in your report, for the proof of the pudding is in the eating, and time will show whether the movement collapses either for want of men or of money. This, however, I will add, that the movement does not neces- sarily depend upon financial help, as I endeavoured to make clear to your reporter yesterday. Indeed, my view of passive resistance is that it  is impure so long as it has to depend upon any pecuniary assistance whatsoever. It is essentially a religious force, but I do not claim for the movement, in which I am a humble participator, that it has reached the purest stage. When it does, it will be independent of any public demonstration in the shape of public meetings, resolutions or appeals to even England and India. Our ideal is that truth, in order to assert itself, needs no such props. We are striving to reach it, and we can but die in the attempt.
 Lastly, permit me to say that the statement that passive resisters “demand payment for their penance, there must be compensation for enforced confinement, martyrdom is on a money basis,” is an atroci-
 
 ous libel, and a cruel wrong to the men and women who have suffered during the last campaign, and who will suffer now. A statement of disbursements was published some time ago, and details are open to inspection by any person who may care to go through them. There never has been any payment to passive resisters for their services as such. There has been maintenance given to the dependants of those who were in gaol, and the payments were made for barest necessities of life. Your reporter should challenge his informants for facts in support of the statements made by him. Indeed, fairness should have dictated this course to him before he undertook to publish them in the confident and emphatic manner in which he has. Nothing could have been easier for him than to have at least come to me and asked me to refute or corroborate them. He admits that there was no want of candour on my part in replying to any questions he put to me.
 I am, etc.,
 M. K. GANDHI
 
 The Transvaal Leader, 1-10-1913
 
  "
218,"September 30, 1913",LETTER TO MAGANLAL GANDHI,"
  
 
 September 30, 1913
 
CHI. MAGANLAL,
 
I have your letter. Send a copy of the paper to Mrs. Blair.
I have left behind a watch there in the [jacket] I wear at home.
Please look for it and find it.
 Manilal, Medh and Pragji tried hard yesterday to get arrested, but did not succeed. They have gone out [hawking] again today. The women will set out in a day or two.
 Let me know under what strain you have to work. Does Shanti give trouble?
 
     [PS.]  Blessings 	from  MOHANDAS      	If you find any letter of Raojibhai’s in the jacket or anywhere 
  	else, please send it. There is something about Gordhanbhailibtech_449_footnotein  it.  I have received Bhayat’s papers. I am 	sending herewith Rustomjee Sheth’s power [of attorney] for 	attestation. Sign it as witness and keep it safe. I also send some 	matter for the press. Send on to Omar Sheth the power [of attorney] 	in his favour. Ask him to affix a five[-shilling] stamp on it. Medh, 	Pragji and Manilal have been arrested.    From 	the Gujarati original in Gandhiji’s hand: C. W. 5653 Courtesy: 	Radha- behn Choudhri                  
  "
219,,THE LATE MR. HAJI HOOSEN DAWAD MAHOMEDlibtech_450_footnote,"
  
 
 The rose has withered in its bloom. Young Hoosen has died in the prime of life, leaving a nation in mourning.  He was but twenty-two, but he carried on his shoulders a head that would sit well on a wise man of forty-two. Truly do the gods take away those they love best. Had Mr. Hoosen Dawad lived to see the winter of life, I feel sure that he would have left a mark on the history of the Indian community in South Africa. Not that he has not, by the purity of his life, influenced it even now. But what he was able to do was merely the shadow of what was to come. He was a young man of truth for which alone he lived. He was impatient of cant, hypocrisy and humbug even in those who were his elders. He stood up for truth against all odds. From his early age, he wanted his word to be as good as a bond. He was innocence personified. No evil company could influence him. He influenced his companions, no matter how depraved they might be. Once Mr. Dawad Mahomed wrote to him, asking him to beware of snares that lured young men in London and of bad companions. He was indignant and wrote almost in these words: “Father, you do not know your boy. Snares cannot affect Hoosen. Bad companions mislead those who do not know where they are. Your son knows where he is. He lives for truth and will die for it.” To this sterling character, he added a burning enthusiasm for his country, India, which then existed only in his imagination. He had never seen it. But it was enough that it was the land of his forefathers. He had read about it and he had learnt to love it with a passion that could not be stifled. “O, Mr. Rustomjee,” young Hoosen said to him when he  went forward on the 16th ultimo as a passive resister, “if I rise from this sick bed, you will find me in gaol. What a glorious death it would be, to die in gaol for the sake of Truth and Justice!” He clung to life desperately. But his desire was unalloyed with selfishness. He wanted to live in order to serve his country and humanity.
When quite young, he began to hate trade, though Mr. Dawad,
 
 
 his father, was and is a merchant prince. He scorned possession of wealth. He wanted to study. He was placed with me at Phoenix by Mr. Dawad Mahomed and the whole settlement began to value the golden worth of the boy. He became a loved member of my family. But Phoenix was not enough for him. He liked the life but he wanted scope for his literary and political tastes. He wanted to fight his country’s battles. He felt a call. He thought (I think erroneously) that it was necessary for him to go to London and become a barrister, if he was to do any good. He was the idol of his father. He went to London amid the good wishes of all. In London he soon made himself loved wherever he went. He applied himself to study. And I know that he used to go to Hampstead Heath, sit on the damp grass, read his favo- urite poets and lose himself in dreams. He used even to compose poems which, those who can judge tell me, were promising.
 But it was ordained that Hoosen was not to live. The dread disease that destroyed his body began its operations upon it in  London. He tried many cures. He was under the treatment of specialists. He rallied for a time, but was never cured. He returned to Durban and felt better. Dr. Adams, who loved Hoosen, treated him with rare attention. He was better, but only better. He was longing to go to England and study. He went to India and saw it with the eye of reverence. He said, in one of his many letters to me, that he wanted not to see the stone work of India; he wanted to see its heart. He went with his father and a distinguished company to the Holy Shrine in Arabia. The pilgrimage made a lasting impression on him. In one of his letters, he broke into raptures over the powers of the Prophet who could summon millions, year after year, to pay their homage to the Creator in this special manner. Thence the party proceeded to Constantinople whilst the war with Italy was going on. Young Hoosen was really his father’s guide and friend. The whole company leant on him during this visit. The highest in Turkey were seen by them. There, too, in that strange land, Hoosen became the favourite of those who came in contact with him. He parted company with his father there. His second Mecca was London. He must go there to finish his studies. But the fiend never let go the grip of him. He was suddenly taken ill. Mr. Dawad Mahomed received a cable, saying that Hoosen was returning. It told its own tale. The father knew that the son was
 returning to die in his lap, and so he died, conscious to the  last moment, in the lap of a father whose love was rare. (I had almost said, supernatural.) Mr. Dawad Mahomed became Hoosen’s exclusive nurse. For five long months and more, this loving father never left the side of Hoosen’s bed. It was a privilege to me to make a pilgrimage to Mr. Dawad’s house to see the young patient whenever I  was  in Durban and it was a treat to see how Mr. Dawad nursed the son and how the latter relied entirely upon his nursing and no other. Dr. MacKenzie, assisted by Dr. Adams, treated him. But Hoosen never left the bed that he occupied on his return from Turkey.
 The funeral procession was enormous. Thousands followed the hearse. Hindus from all provinces of India vied with the Mahomedans in paying their respects to the memory of this good youth. Colonial-born Indians mustered in strong force to pay their respects to the memory of one who, like themselves, was born in South Africa. Special trams emptied themselves at Congella, during practically the whole of the Tuesday on which the funeral took place. All Indian shops in Durban were closed for two hours and so was the Indian Market, by consent of the Corporation. No Indian has ever received the spontaneous tribute to his memory that this young man of brilliant promise received. His death made us all forget, for the moment, that we were Hindus, Mahomedans, Parsees or Christians. He, even in his death, makes us realize that we are sons of India after all—we are kith and kin, owning the same mother. I have loved to linger on Mr. Hoosen’s character. I knew him as few did. And it has not been my good fortune to meet many young men—aye, even old men—with a spotless character that Hoosen possessed. To me Hoosen is not dead. He lives in his character. May this humble tribute be accepted by Indian youths throughout South Africa in the spirit in which it has been offered, and may we all copy the example set to us by Mr. Hajee Hoosen Dawad Mahomed.
 Indian Opinion, 1-10-1913
  "
220,,THE MARRIAGE QUESTION,"
  
 
 The struggle, this time, involves so many matters of highest importance that it is well to devote particular attention to each. We dwelt, last week, on the £3 tax question. This week we propose to examine the marriage question which, in so far as it has drawn our women into the struggle, is of even greater importance than that of the annual exaction from ex-indentured men, women and children.
 The marriage difficulty dates from the Searle judgment. It is, therefore, necessary to understand the position that existed before that now historic judgment. Little did Justice Searle know what effect his judgment was likely to produce  among the Indians of this sub-continent.
 Before the judgment, Indian wives were recognized as lawful married wives of their husbands. The masters of the Supreme Courts of the different Provinces recognized the claims of such wives and their issue in intestate estates. Never did an Indian have cause  to suspect that the legality of marriage might be questioned  by  the Courts of South Africa on the ground of the want of its Christian character or the want of registration in South Africa. But the Union Government, in pursuance of their policy of greater repression of the Asiatic than before and not being satisfied with their attack on the male members of the community, wanted to extend their hostile operations to our womenfolk. Some zealous law officer discovered that it was possible to prevent the entry of wives of domiciled Indians by declaring their marriage to be illegal in terms of the South African law. They, therefore, challenged the entry of such a woman at the Cape, and Justice Searle was called upon to decide the issue now raised for the first time by the Government. The learned Judge pronounced marriages performed according to the rites of a religion that allows polygamy to be illegal, and, as the person, claiming before him to be the wife of a domiciled Indian, was a Mahomedan, her marriage could not be recognized by the Courts of the Union. This  ruling  was followed by the Master of the Natal Provincial Division of the  Supreme Court. The Master rejected the claim of the only wife of a
 deceased Indian for exemption from succession duty by reason of her marriage not being in accordance with the laws of the Union. The doctrine was carried to its furthest limit by Justice Gardiner when he declined to recognize the marriage of an Indian wife when she claimed exemption from liability to give evidence against her husband in a trial against him upon a charge of murder. Thus, suddenly, non-Christian Indians found that, in South Africa, their  wives occupied merely the position of concubines and their children were considered illegitimate. The reader must remember that, not only does this discovery of their awful position hurt the susceptibilities of a proud race, but it also effectually prevents the entry of almost every Indian wife and every Indian child. If the Government had dared to follow out the consequences of the Searle judgment which they deliberately invited, not an Indian wife or her children could have entered the country. That would have been an injustice which even the humanity of the Europeans of South Africa would not have tolerated. Therefore, after having us at their mercy, the Government were graciously pleased to declare that the judgment would not interfere with the practice of the administration to admit the wife of a domiciled Asiatic so long she was the only wife of his in South Africa. This so-called forbearance, it must be remembered, would not have saved the wives and children thus admitted on sufference from the other consequences already adverted to of the Searle judgment.  Indians were not to be satisfied with exchanging the legal status of their wives for a position of total uncertainty in law, notwithstanding their admission. They were not prepared to put up with the implied slur on their womenfolk. The Government, therefore, reluctantly, in a most niggardly spirit, and in instalments, accepted, first Mr. Alexander’s and then Senator Schreiner’s amendments to the Immigration Bill that was under consideration by the Union Parliament. But the amend- ments, being hastily drawn, gave (if they did at all) partial relief only. For they legalized Indian monogamous marriages celebrated outside South Africa, no matter under what religious rites they were solemnized. These amendments, therefore, left undefined the status of women married or to be married in South Africa. Indians now con- tend that Indian marriages celebrated in South Africa  should  be placed upon the same footing as those celebrated in India. And this, as
 has beenlibtech_451_footnotepointed out to the Government, can be done   with  but  a slight alteration in the Immigration Act or by an amendment of the marriage laws of the Union.
 We have used the expression “if they did at all” with reference to the relief granted by the amendments. This qualification  has  become necessary owing to the attitude of the Government in the case of Kulsumbibi now pending before the Supreme Court. The Immigration Officer at Durban, no doubt upon instructions from the Government, has raised the question whether a marriage celebrated under the rites of a religion which permits polygamy can be called monogamous, although the woman so married may be the only wife of her husband. This issue the Government need not have raised. But they evidently intend to show that the amendments made were not made in good faith. They were made ostensibly to meet the Indian demand for legalizationlibtech_452_footnotelibtech_453_footnoteof Indian marriages. Mr. Alexander’s amen- dments fell short of that. Mr. Schreiner’s was, therefore, accepted. The Government knew that the most popular religions of India, viz., Hinduism and Islam, did not prohibit polygamy. If, therefore, they accepted the amendment with the mental reservation that the adjective “monogamous” would by law still exclude the women married according to the rites of these two great  religions,  they certainly misled Parliament and the Indian community. We think that the Supreme Court will reject the Government interpretation, but, should its decision be otherwise, it certainly will be necessary to alter the Immigration Act in order to clothe all Indian marriages with legality. Even at this eleventh hour, the Government could withdraw the case and not challenge a decision.
 Then, there remained the question of the admission of plural wives as distinguished from their legal status after admission. The practice has been always to admit such wives of domiciled Indians. In the Transvaal such unions are even noted on the registration certificates. The first shock of disturbance in this practice was felt in 1911 by a decision of Justice Wessels,libtech_454_footnotewhich, too, was invited by the
 
 Government. As a result of the decision, the British Indian Association carried on correspondence with the Government and an assurance was given by them that all cases of hardship would be considered by them. This correspondence seemed to settle the question, for the Indian demand as to plural wives is not for legal recognition but for admission into the Union of the existing plural wives of domiciled Indians. But the disposition of the Government seems to be now to recede from the assurance contained in their communication. We shall reproduce this correspondence in our next issue so that the reader may judge for himself whether the correspondence can bear any other interpretation than that put upon it by the community.
 To sum up, then, the demands of the community are simple and three-fold:
 (1) Legalization of monogamous marriages already celebrated and to be celebrated in South Africa; (2) The term “monogamous” to include marriages celebrated according to the rites of religions that may not prohibit polygamy, so long as the woman whose union is to be recognized is the only wife of her husband; (3) the admission of existing plural wives of domiciled Indians without granting such wives a legal status apart from full residential rights.
 Indian Opinion, 1-10-1913
  "
