chapter_no,date,title,content
 the eye. If we wish to use again an envelope which has been used once, the address written on it should be covered up. For that purpose Sardar stuck over the written lines finely cut slips of paper of appropriate sizes, and that gave the envelope an attractive appearance. But he was not satisfied with this. So now he turns the envelopes received from there inside out, so that he need not paste slips over them and the envelops may look as good as new. You will discover this if you examine them closely. Your slips with zigzag. edges had half come off and looked very shabby. And they served no practical purpose. Your labour, therefore, was wasted, and so were the time and the paper. That was a loss to the public. Draw two lessons from this: never imitate anyone blindly, and beauty created for its own sake is no beauty. It is said about the great cathedrals in Europe that all their beautiful features serve a practical purpose. Whether this is true or not, there can be no doubt about the truth of the principle which I have stated.
 Your letter this time contained very little besides a criticism of the Minister. I think is unnecessary to consider whether or not your criticism is justified, since it can have no effect. The statement “judge not lest ye be judged” deserves to be engraved in our hearts. I do not know if there is a Gujarati saying with a similar meaning. If there is any in Marathi, send it to me.
 I should like to have a list of the Urdu books. In any case, send Shibli’s volume. I know that Khalifa’s biography, too, is there.
 I should certainly like it if you would prefer to die rather than eat fish. Does that mean that you would not take codliver oil too? You need not consider what I would wish [you to do]. I have put the question simple to know your own attitude. You should increase milk/curds and/or ghee in your diet. It must also include occasionally some ripe fruit in place of uncooked vegetable. Don’t you grow papayas there? Or tomatoes? Or bhajilibtech_256_footnotelibtech_257_footnoteof any kind? Why should you, yourself, not grow some tomatoes? And also  lettuce—it  grows quickly. Unripe papay ought not to be eaten in large quantity. Nor should it be eaten daily. Introduce this change without thinking about the expense. Keep up Kuhne-baths with hot water. It is very necessary to massage the spot where you feel the pain. Any girl will be glad to do the massage.
 
 
 Vidya’slibtech_258_footnotelibtech_259_footnotedullness will disappear if you try to teach her with love. Rambhau’s case is a little difficult. There is only one remedy, how- ever. There are three influences working on him. If they do not work in harmony, there will be a problem. The three influences are:  Panditji, Lakshmibehn and you or anybody else who looks after him. Only love will enable you to discover a way out of this difficulty. In the measure that your love becomes wider in scope, in that measure will your capacity to reform such children increase.
 Be generous towards the grown-up girls in the Ashram. They do not purposely shirk work and sit idle at home; they do not work beca- use they become helpless. You and I cannot judge the degree of their helplessness. They alone can do so. Their judgment may, of coures, be wrong. But we should be satisfied if their motive is not dishonest. Among the grown-up girls, think about Anandi, Kusumlibtech_260_footnotelibtech_261_footnoteand Nimu. What could all these girls do? Anandi is not likely to shirk work. Kusam at any rate will never do so. Nimu is burdened with two children. She hardly knows how to bring them up, but has already become a mother. How much work, therefore, can we expect from her? Perhaps you will be able to think of many more instances. We cannot weight all such cases in scales with which we weigh gold and pearls. You will also see from experience that as you become more generous you will find it easier to make others work. I don’t know how far it is true, but is said [about me] that I have great capacity for making men work. If this is true, the reason is that I never suspect anyone of shirking work. I am satisfied with the work that a person does. I then ask him to do more, and he does. There are also somewho say that there will be hardly anyone whom people deceive as much as they do me. Even if this assessment is proved correct, I shall not feel sorry. I would be satisfied if people give me a testimonial that  I deceive no one in the world. If nobody else gives such a testimonial to me, I certainly give it to myself.
I hate untruth more than anything else.
 I don’t believe in the principles of “the greatest good of the greatest number” and “survival of the fittest”. For man the rule is, the good of all, the progress of all and “the weak first”. We bipeds
 
 are human beings, but we have not yet risen above the nature of quadrupeds. Dharma lies in doing so.
 BAPU
 From a photostat of the Gujarati: G.N. 10293. Also C.W. 6741. Courtesy: Premabehn Kantak
 
   LETTER TO MATHURADAS PURUSHOTTAM  
 July 6, 1932
 CHI. MATHURADAS,
 I got your letter. You should not belittle your idea of sewing for yajna. Its real value lies in turning to use even the poorest quality of khadi. We cannot afford to pay for sewing. However, those who are ready to do sewing as free service can give even to the most unattr- active khadi the value which devotees of God give to flowers  by making garlands for the deity from them. For instance, one who gives such service should not make shirt from bad khadi, but he can make quilts, bagos or pillows from it. We can think of a number of things made from such khadi which would not need to be washed and which could be used for a long time in the same condition. I had a hand spun and hand-woven wollen blanket with me, which I had received as a gift. It had been so much worn out be use that, if used longer, it would have not torn out into pieces. But, being of an ingenious turn of mind and having a friend like Janakibehnlibtech_262_footnotelibtech_263_footnotelibtech_264_footnotewho is ever ready to help me, I gave the blanket to her and told her how she could make it into a new one. The blanket is still with me. I deliberately took it with me, when I visited the Royal Palace in England.libtech_265_footnotelibtech_266_footnoteLet me explain, too, how the blanket was made new. It was sewn on to a piece of thick khadi, the whole surface being stitched both length-wise and breadth- wise. The wornout woollen blanket, being thus lined with khadi, become as good as new and gave more warmth than before. This does not mean that the effort which you are making for improving the quality of yarn is unnecessary. I daily realize the necessity of such effort. But such improvement will not reduce the importance of sewing for yajna or dispense with it. The love of khadi has still not spread widely in the country. It means, in other words, that love of the poor has not spread so, or, even where it exists, the people who have it
 
 
 are ignorant and are not yet convinced that the best way of showing their love is by patronizing khadi. If they can be convinced of this, your discovery can become very useful. I have not, therefore, become indifferent to it in the slightest degree. Do write a book on how to spin better yarn. But do not make a single statement in it the truth of which you have not tested. Nor should you deduce any general principle only on the basis of exclusively your experience. Others also must have found it true. If you have not checked all your statements in this manner, postpone writing the book. I observe again and again that books which have no basis in experience are practically without any value. For instance, if anybody translated Charakalibtech_267_footnotelibtech_268_footnote, the work would not be of any use today since we cannot find many of the herbs and plants described by him and, with regard to those which we do find, cannot prove the properties attributed to them. The most important thing therefore is that you yourself should spin the finest possible yarn of different counts and, while doing so, analyse and note the contribution of the spindle, the type of the spinning-wheel, the quality of the cotton used, the quality of the carding and your own, that is, the spinner’s skill towards the result. Then tally your experience with that of other spinners. A book based on such data will accepted without question, like a bar of gold weighed on the scale kept in the market for public use. You asked me what limit I have fixed with regard to the count of the yarn spun. Previously I had fixed it at 20, then raised it to 40. I do not lay down any limit now. If we can get or grow cotton from which we can spin yarn of 400 counts and which we can card well enough for such purpose, and if we can get men or women spinners who have sufficient patience to spin yarn of such quality, I would certainly desire that we should reach that level. In short, I think it very important that we should go in this direction as far as we can, for this is likely immediately to enhance the value of the art of hand- spinning. I am sure you know that a friend of Satis Babu had reached up to 150 counts. The khadi woven from it is preserved in Satis Babu’s collection. But along with this I also insist that as we progress in spinning yarn of finer and finer count the yarn should always be strong and even. I cannot say what marks any specimen of yarn should earn for passing the test in these respects. Only you and other experienced spinners can say that. I certainly have a rough test for this
 
 purpose, and it is that any weaver should be able to weave the yarn without difficulty. If a weaver rejects a lot, I would treat it as below par though it may have passed our test. When I get the cup, I will try the method suggested by you and test the strength of my yarn. Even without testing it, however, I know that it is not good enough, and I am myself not satisfied with it. Because of the pain in my elbow, I have had to change from one hand to the other [for drawing the yarn]. My hand had set very well on the Gandiva spinning-wheel and I could spin on it yarn of sufficiently uniform quality as I wished, though the speed was not much to speak of. But I was obliged to draw the thread with the right hand and then to spin on the Magan spinning-wheel, with the result that it is only now that I have acquired some control over it. As if this was not enough, I thought it my duty to use up the very inferior quality of slivers we had and I began spinning them. I have now resumed spinning with good slivers since a few days ago, and so, by the time your cup arrives and I try it, my yarn will have become good enough to pass the test. Previously I used to spin yarn of about 25 counts, but after I started spinning with the Magan wheel I remain at about 19 counts. Probably I will go up now. I think I have now answered all your questions. Have courage and cultivate strength of mind. Don’t think too much. How is Motibehnlibtech_269_footnotelibtech_270_footnote?
I have received the cup.
   From 	a photostat of the Gujarati: G.N. 3755  BAPU 
      LETTER TO FEROZABEHN TALEYARKHAN    July 	6, 1932  DEAR 	SISTER,  	Received your letter. You must be having the benefit of cold 	weather. Information has been received about Devdas being comple- 	tely cured and hence there is no cause for anxiety. You are keeping 	yourself well-informed. Ba is happy. My visits are still disallowed. 	Vandemataram from the Sardar and Mahadev.  Blessing 	from  BAPU  Bombay 	Secret Abstracts, Home Department, Special Branch, File No. 800 (40) 	(3), Pt. II, p. 173    
  
        BROTHER,    LETTER TO PARAMANAND      July 	6, 1932 
  	I have today learnt from a newspaper the news of your wife’s 	death. When you were imprisoned in the Andamans I had come to know 	her and was much impressed by her simplicity. May God grant you 	peace and patience.  Yours,  MOHANDAS 	GANDHI  Bombay 	Secret Abstracts, Home Department, Special Branch, File No. 800 (40) 	(3), Pt. II, p. 163      LETTER TO PARASRAM MEHROTRA    July 	6, 1932  CHI. 	PARASRAM,  	I have both your letters. Whenever there is doubt about the grammar 	of a Hindi word, is not consulting a dictionary the right course? 	One who knows Sanskrit will  commit  fewer  mistakes  in using his 	words. But a word used in Sanskrit in a particular sense would not, 	as a rule, be used in the same sense in Hindi. We should therefore 	regard the dictionary as an authority. And where the help of the 	dictionary is not available, we should regard one who knows Sanskrit 	as an authority. I looked up the word nirutsaha [wanting in 	enthusiasm] in the Hindi dictionary which is with me, and there also 	it is termed an adjective. Hence one who knows Sanskrit and the 	dictionary both agree about it. I write all this merely out the love 	of language. I expect a higher knowledge of the language from those 	who know a particular language. I also expect them to use it 	correctly. Hence I asked about the word  nirutsaha in   my  last  letterlibtech_271_footnotelibtech_272_footnote.  I  have always thought your knowledge of Hindi to be 	sound and I expect you to be more and more vigilant about it day by 	day. Someone must dedicate his life in the service of Hindi. 	Politics is always on our neck. But this cannot be nor should it be 	an exclusive field. We might have willingly or unwillingly plunged 	into it, but as soon as its activities calm down, we should return 	to our pursuit. Also not all of us need    
 plunge into politics at all times. Hence we should select, according to our capacity and inclination, any of the many permanent and constructive activitieslibtech_273_footnote. You certainly have a liking for Hindi. Now I would like you to think of dedicating your life for the spread of Hindi after adding to your knowledge of Hindi as much as you can. I do not mean to say that you should make this resolve soon. For the present you may carry on what you are doing. Most of your time is already taken up by Hindi. Whether you should stick to Hindi till the end of your life will become clear by itself in course of time. Just now I have simply sown the seed.
 Now about the Ramayana. What you write on this subject is true. I do not regard the  Ramayanas such as by Radhasoamilibtech_274_footnotelibtech_275_footnote, etc., to be refined works. The Ramayana of Tulsidas is a work of great refinement. We only have to create interest in it. We can surely bring out an abridged Ramayana in Tulsidas’s own language. I had made an attempt with regard to the ‘Balakanda’libtech_276_footnotelibtech_277_footnote. Most probably there is a copy in the Ashram. Twenty years have passed since then. If I were to take up the task again, perhaps I would choose entirely different quatrains and couplets from it. Prabhudas has also made an attempt in this direction. As you are engaged in teaching, it will be useful if you did something in this direction. Also you ought not to have much difficulty. Mahadev tells me that two or three such attempts have already been made in the U.P. But that need not deter you. There is no harm if a fourth is added to them. People of different tempera- ments, keeping in mind children or people of a different class, would make different sections. I will not insist  if  you  do  not  get  time during the evening prayer. The Hindi classes are always there. Try to create interest in the Ramayana whenever possible. Also if some wish to study the Ramayana out of devotion, and if you can spare time, you may arrange for such a class once or twice a week. But I do not at all insist on it. I am only expressing my desire. You alone can say how and to what extent it can be carried out.
 You must be perturbed, as I write all this. I think your work is going on well. Comparatively you were never more at ease than now and I do not at all wish to disturb you or make your mind unsteady
 
 by putting before you new ideas or schemes. These thoughts came to my mind on reading your letter and so I have placed them before you. Accept out of them whatever you can fully understand, digest and put them into execution, and forget the rest. Even if you discarded the whole lot, I would not be shocked.libtech_278_footnoteI  have  only  one mighty desire for you that you may feel yourself entirely at ease and may not be embarrassed at all.
 BAPU
 From the Gujarati original: C.W. 9643. Courtesy: Parasram Mehrotra. Also Bombay Secret Abstracts, Home Department, Special Branch, File No. 800 (40) (3), Pt. II, pp. 213-9
 
   LETTER TO MATAPRASAD GUPTA  
 [July 6, 1932]libtech_279_footnote
 BROTHER MATAPRASADJI,
 Received your letter as well as the book. Prisoners are prohibited from giving their opinions is regard to books. Therefore  please  excuse (me). Moreover, I am not entitled to express an opinion on  a book on the culinary art, and I cannot express one.
 Yours,
 MOHANDAS GANDHI
 Bombay Secret Abstracts, Home Department, Special Branch, File No. 800 (40) (3), Pt. II, p. 171
 
   LETTER TO AN AMERICAN CORRESPONDENT  
 July 7, 1932
 DEAR FRIEND,
 I was touched by your letter. If you can possibly stand the climate of this country and the strenuous life of the Ashram, I would be delighted to have you as a member. There is no fee to be paid and you will not be called upon to pay for your board and lodging, so long as you can share the common meal. But the life is hard and incredibly simple. All the inmates are expected to labour in the field and the factory for a certain number of hours daily. All work, including scavenging, is done by the inmates. The dress we wear is
 
 also very simple and is all hand spun and hand-woven, and sewn at the Ashram. If, therefore, you feel inclined to venture out, whilst you are welcome, I would warn you against coming unless you have enough funds to take you back to America in the event of the climate or the institution not being agreeable to you. In spite of this letter [if] you desire to come to India and join the Ashram, I would like you to see Mr. Richard Gregg, who has lived at the Ashram for a long time and knows all about it, and you will not think of coming unless he gives you encouragement. His address is: Richard Hurst Hill, Esq., Spl. Asstt. to the President, Howard University, Washington, U.S.A.
 Yours sincerely,
 M. K. GANDHI
 From a copy: C.W. 9319. Courtesy: Narandas Gandhi
 
    LETTER TO MANIBEHN N. PARIKH      CHI. 	MANIBEHN (PARIKH),    July 	7, 1932 
  	Mahadev has talked to me about your letter to him. How can you help 	if your body does not give service? If all those inmates of the 	Ashram who cannot work were to be asked to leave, we would have to 	send away many of them. You need not feel ashamed. Those who spare 	their bodies and shirk work should feel ashamed. If the Ashram 	cannot maintain persons like you, it should be considered useless.  BAPU  From 	a photostat of the Gujarati: G.N. 5970. Also C.W. 3287. Courtesy: 	Vanamala M. Desai   
    LETTER TO RAIHANA TYABJI      MY 	DEAR DAUGHTER RAIHANA,    July 	7, 1932 
  	I have not received any letter from you this week so far. I have 	read with great attention the bhajan and the ghazal which 	you sent to me. I liked both of them and fully understand them now. 	The bhajan is easy to understand, but there was some 	difficulty in understanding the ghazal as it contained new 	words. But I fully understood it after reading it over two or three 	times. The ghazal is very good indeed. I suppose “Zafar” 	is the nom de plume of Emperor Bahadur Shah, is it not? Send me more 	such ghazals from time to time. You wrote to me once that you 	would find out and send a suitable book for me. If you 
 have forgotten your promise, please remember it now and send a book if you find one. At present  I  am  reading  some  books published by the Jamia Millia. All of them are full of good thoughts. Two of the books were plays. The book I am reading at present contains stories like the “Kimiyagar” and others. Have you  seen these  books?  Convey  respectful  greetings  from  us  all  to  Father and Mother. As for you, a little squeezing of your ear on my behalf, which may be done by Kamal. I am waiting for  a  letter  from  Hamida. Uncle Sardar is still reading Amir Ali’s book. The rains have now set in here. Cultivators were worrying. The weather has become now fairly cool. I hope Pashabhai’s sister is all right now.libtech_280_footnote
 You should correct in the foregoing not only spelling mistakes but grammar  mistakes  also.  The  Urdu  book  which  you  send  to  me will be more useful if it also contains a glossary of  ordinary words, rules of  grammar  and  spelling,  etc.  If  there  is  no  such  book you need not trouble yourself.
 Blessings from
 BAPU
 From a photostat of the Urdu/Gujarati: S.N. 9647. Also Bombay Secret Abstracts, Home Department, Special Branch, File No. 800 (40) (3), Pt. II, p. 151
 
    LETTER TO ZOHRA BANU ANSARI      MY 	DEAR DAUGHTER ZOHRA,    July 	7, 1932 
  	You will be surprised to read this letter. The reason for writing 	this is that now the Bapalibtech_281_footnotehas been released, you may write to  me about his 	health. (Let me also know) how much weight he has lost. What have 	you been doing all these days? Sardar Vallabhbhai and Mahadev Desai 	are with me. We are all in perfect health. Convey our respects to 	(your) father and mother. May God give you long life and may He make 	you great servant of the country! Write to me soon. If you write a 	beautiful hand, then alone I shall be able to read it.  MOHANDAS 	GANDHI  Bombay 	Secret Abstracts, Home Department, Special Branch, File No. 800 (40) 	(3), Pt. II, p. 153     
  
 
          DEAR 	RATILAL,    LETTER TO RATILAL P. MEHTA      July 	7, 1932 
  	Have you not completely forgotten me now? Do not remove Shashilibtech_282_footnotefrom the Sharda Mandir at all. He is being taught 	properly there. You must be happy.  BAPU  Bombay 	Secret Abstracts, Home Department, Special Branch, File No. 800 (40) 	(3), Pt. II, p. 191   
          DEAR 	KUSUM (JUNIOR),    LETTER TO KUSUM      July 	7, 1932 
  	What was the question you asked me? I have entirely forgotten. You 	write it again and I will answer it. I thought that I had already 	answered all questions. It is certainly good to absorb the rays of 	the sun sitting under a neem tree. You should start taking a 	hip-bath. By it, the temperature will certainly go down. Rest is 	certainly  the principal item. You should not feel tired at all when 	you go out for a walk. When you can read and play only the sitar, 	how do you feel tired? Raichandbhaina Lekho, (or writings of 	Raichandbhai), all parts of Kavya Dohan, Naval Granthavali, 	Astodaya, Gujarati translation of Shakuntala, selections 	from the Gujarati Reading Series, works of Kakasaheb, books by 	Kishorelalbhai, etc. All these will be more than enough. Many more 	can also be mentioned.  BAPU  Bombay 	Secret Abstracts, Home Department, Special Branch, File No. 800 (40) 	(3), Pt. II, p. 191            
  
    LETTER TO SITALA SAHAY      BROTHER 	SITALA SAHAY,    July 	7, 1932 
  	Our letter to  hand.  I  have  carefully  gone  through  it.  It  is 	 not proper that  you  should  compete  with  Prabhudas. It  is  	likely that Prabhudas’s expenses might be less as he gets some 	other conveniences. Some estimate can be arrived at from the 	expenses incurred by Prahbudas. But, as a matter of fact, the 	unavoidable expenses only are to be taken into account. A big amount 	was to be spent for Rasik all of a sudden. Maganlal fell ill and 	died at such a place in Patna that no expenses were incurred. One 	time, Krishnadas did not incur any expense. But when he was removed 	to Dehradun, the expenses rose at once. Hence, ultimately every case 	is to be separa- tely considered. We can only desire and demand from 	them that they should spend money thoughtfully and keep an account 	of the money spent. The Ashram can spend so far as it can afford to 	do it. When the Ashram cannot afford, we should all assemble in the 	Ashram and suffer the consequences and while so doing should laugh 	and enjoy the pleasure. I have suggested this to Narandas also. On 	looking at the bill of Padmalibtech_283_footnotelibtech_284_footnote, if there is anything to be said, it should be written 	to you if you are there or to Padma. Is not this proper?  BAPU  Bombay 	Secret Abstracts, Home Department, Special Branch, File No. 800 (40) 	(3), Pt. II, p. 211   
    LETTER TO LAKSHAMI      DAUGHTER 	LAKSHMIlibtech_285_footnote,    July 	7, 1932 
  	If Devdas had not sent me a wire, from where could  I  have  got 	intimation of Papa’s condition? I hope you are at present working 	like a brave woman. Please let  me  have  all  information about 	Papa. I have written a letter for Papa  and  I  am  sending  it 	along with this. Now Anna must have come to the Ashram. Tell him to     
 write to me.
 Do not spoil your health by worrying. Fear of death and sorrow should be abandoned altogether. Why should there be pain and fear for a thing which is inevitable for every human being? It is ignorance to regard death as a punishment from God. Death is a gift to man from God.
I expect a long letter from you.
 Blessings from
 BAPU
 Bombay Secret Abstracts, Home Department, Special Branch, File No. 800 (40) (3), Pt. II, p. 149
 
 
          CHI. 	SHAMAL,    LETTER TO SHAMAL R. RAVAL      July 	8, 1932 
