chapter_no,date,title,content
 Comparing it with the Magan spinning-wheel, I see that I cannot acquire speed on the latter. Hence I think that for spinning with one spindle only, the Gandiva or the ordinary spinning-wheel is better. For anybody who cannot use either of his hands for drawing the thread or for rotating the wheel, the Magan spinning-wheel is an invaluable invention. Obviously, anyone who can use both his hands can spin more. But we cannot spin yarn of the highest count on it. A few changes may perhaps help us to do it. It is also possible that our speed on it may increase if we make some modificatons so that we can spin on it with one spindle only. But all this requires experimentation. My experience of it in its present form is what I have described it to be. I can say that I have now acquired excellent control over the pedals.
 I have been permitted to spin on the Gandiva wheel not because there is any improvement in the condition of my elbow but because complete rest has not benefited it in any way. The assumption behind this is that the pain may not have been caused by the  strain  of [rotating] the wheel when spinning. I shall know for certain in a few days.
 I am happy that Dr. Talwalkar charges two rupees for conveyance and gives a bill for the medicines. If we call him only once or twice in a year, he can afford to charge us nothing, but he cannot afford to do so when he gives us medicines as frequently as he does. He is not so rich. As for conveyance, I think we have been paying it for a long time. Dr. Talwalkar’s sending us bills for medicines is likely to have one result. Through laxity we may have been calling him during all this time even when it might not be necessary. If that is so, our laxity should go now.In any case, if we are scrupulous in following dharma, we should feel extremely reluctant to accept anybody’s free services. But most people certainly do not behave in that way. Because water costs nothing, we use it freely and do not feel ashamed in doing so. On the contrary, we ask why we should not use it freely when it costs nothing. And as we are careless about using water because it costs nothing, we feel in the same way about other services or things which we get free. This is a violation of our vow of nonstealing, besides being a violation of the vow  of ahimsa too.
 I have had no letter from Ba. I wrote one letter to her many days ago, to which I got no reply. And so I have not written to her recently.
 
 I simply do not understand what happens to these letters. I will write once again to her, and put the letterlibtech_414_footnotewith this. If you get it, show it to the Jail Superintendent there and give it to Ba. I hope all those who had got cold have recovered now. There is a wire from Devdas informing me that he had a mild relapse of fever. If you get this letter and if Shanti is there at the time, give him and his wife my blessings and tell him that I was happy that he had gone there. Did he get my letter? I wrote it to him at Rajkot.
 It will be enough if you send the slivers, given by Chhakkaddas, to Dahyabhai with anybody who may be going to that side. I have a stock of other slivers with me. It will not matter, therefore, if Chhakkaddas’s arrive a little late.
 Is Parnerkar’s health all right? I am sure Prithurajlibtech_415_footnotelibtech_416_footnoteis quite well. It seems to me from your description that Shankarbhai had a narrow escape. Anyone falling from the roof of the kitchen is hardly
likely to survive, as the roof is at a fairly good height. I hope his arm
is all right now.
 I have fully explained my views regarding Sitala Sahay in a previous letter.libtech_417_footnoteYou will know what they are if you get it. I have also written about Parnerkar’s mother,libtech_418_footnoteas also about Narmada.libtech_419_footnote
 The Jailor informed us that Mahadev’s letter to Durga, written on the 11th, was posted on the 14th. But you had not got it till the 18th, from which it seems that the letters are being tampered with there too.
 You should assume that for some time now you  cannot  be certain of getting my letters—as for the future, let us wait and see what happens. You will find more about this in my letter to Premabehn.libtech_420_footnote
 BAPU
 From a microfilm of the Gujarati: M.M.U./I. Also C.W. 8240. Courtesy: Narandas Gandh
 
 
 
  TELEGRAM TO SUPERINTENDENT, 
 CENTRAL JAIL, LAHORE
 [Before July 21, 1932]libtech_421_footnote
 SUPERINTENDENT CENTRAL JAIL LAHORE
 HEAR		KHURSHEDBAI	NAOROJI	HAD	OPERATOIN.	PRAY	INFORM ME	CAUSE	OPERATION	AND		PRESENT	CONDITION.
 
   Government 	of Bombay, Home Department, I.G.P. File No. 9  GANDHI 
   
          CHI. 	MIRA,   LETTER TO MIRABEHN       July 	21, 1932 
  	I have before me your letter and postcard. The body will take its 	toll. We never know when we commit a breach of the laws that govern 	the body. And in nature as in human law ignorance is no excuse. Your 	fever therefore does not surprise me.libtech_422_footnotelibtech_423_footnoteI 	expect that the energetic remedy adopted by you checked the progress 	of malaria. Yes at such times services of friends become a boon and 	induce an early recovery. I know what lavish care is bestowed upon 	guests in Sivaprasad Babu’slibtech_424_footnotehome. I am glad you are having these sweet experiences. 	It makes attacks such as you had not only bearable but even a prized 	visitation in that they enable one to understand human nature at its 	best. And when it acts equally towards all and in all circumstances, 	it approaches the divine.  	Your description of Ganga is quite poetic. I felt much the same as 	you have done. And it was probably the same spot where I was 	walking. I wrote my impressions for Navajivan. This was quite 	10 years ago I think.  	Milk diet still continues. The weight is 105 libtech_425_footnote/ lb. It has 	produced no effect on the elbow. I feel no better than when I was 	taking      
 almonds and bread. So far as the bowels are concerned, I was most assuredly better under that diet than the milk diet.
 I do not know when you will get this letter. The disturbance  of my correspondence still continues. The incoming post has become regular but there is much delay about the outgoing post. I am in   correspondence   with   the   Government   about   [it]libtech_426_footnotelibtech_427_footnote.   I   cannot understand this sudden disturbance at all. But there it is. Fortunately for the peace of my mind I commenced my career as aprisoner even in South Africa with the assumption that a prisonerhad no rights. If you are still outside prison walls, you will know why you do not get my letters regularly, if you do not.
Love.
   [PS.]  BAPU   Remember 	us to all the friends . If you at all can, try to see 
 Devdas. 	He is so near you.  SHRIMATI 	MIRABAI  C/O BABU 	SIVAPRASAD 	GUPTA 	SEVA 	UPVAN  NAGWA 	BENARES  From 	a photostat: C.W. 9508. Courtesy: Mirabehn   
   LETTER TO DEVDAS GANDHI     MY 	DEAR DEVDAS,    July 	21, 1932 
  	The telegram from Hanumanprasadji today causes anxiety. It seems 	that there is an attack of fever again. It is stated in the telegram 	that the attack is a mild one. Hence I believe that by the time you 	get this letter you must have completely recovered. You must  have 	received the letter (I) wrote before this. Still there is no 	certainty about the post dispatched by me. It seems that my letters 	take many days to get through (the scrutiny). The letters are being 	nicely scrutinized. You must be certainly careful of your health. 	Whatever the climate, I believe that it can be kept under control by 	effecting suitable changes in the diet. Write to me why there was a 	set-back again.    
 It seems that I get my post regularly again. We all three are happy. Vallabhbhai is learning Sanskrit like an industrious school- boy. He devotes many hours to its study. He has finished two parts and is reading the third. There will be no wonder if he finishes all the
 24 parts within four or five months at this rate. Yet, it will be considered a wonder and a miracle if he begins to understand the Mahabharata and the Ramayana in original.
      DEVDAS 	GANDHI 	DISTRICT 	JAIL 	GORAKHPUR, 	U.P.  Blessings 	from  BAPU 
  Bombay 	Secret Abstracts, Home Department, Special Branch, File No. 800 	(40)(3), Pt. II, p. 353   
       BROTHER 	SONIRAMJI,libtech_428_footnote   LETTER TO SONIRAMJI     July 21, 1932libtech_429_footnote 
  	I am in receipt of your letter.libtech_430_footnotelibtech_431_footnoteI 	have heard many interpretations of the occult significance of the 	sacred thread. But all these interpretations are only guesses. I do 	not think that all these ideas were present at the time when the 	sacred thread came into use.  Those people who described themselves 	as Aryans adopted the use of the sacred thread in order to 	distinguish between Aryans and non-Aryans. This must have happened 	at the time when the art of making cloth from cotton was discovered. 	Crores of people merely put on the dhoti then, as they do even now, 	with the rest of the body uncovered. In any case those who are 	believed to be non-Aryans did so. The Aryans, therefore, adopted the 	symbol of the sacred thread in order to encourage and improve the 	art of spinning and prove that it  was sacred work. I have no 	evidence from history in support of this statement. It is only my 	conjecture. Today there is no distinction— and there ought not to 	be any—between Aryans and non-Aryans. An admixture of blood 	between the races took place thousands of years      
 ago and the present inhabitants of India are the progeny of such an admixture. If the sacred thread is to be worn to all, all [the castes] should have the right to wear it. I see no meaning  in  such a movement. For this reason, after giving up the use of the sacred thread I never tried to wear it again nor do I wish to do so. Inasmuch as the practice of wearing the sacred thread is likely to have created the distinction between higher and lower castes, it should be discarded. I would advise Gauri Prasad to give up his infatuation for the sacred thread. It is the sign of a brahmachari. If a person observes brahmacharya that itself is the best sacred thread. Why is a cotton thread needed?libtech_432_footnote
 To keep the water in a  well clean  it  should  be  covered  with  a wire-netting. There ought not to be any dirt anywhere around it. The well should be deep and (a certain quantity of) “permanganate of potash” or chlorine should be put into it every month. The quantity (of the drug) to be used should be ascertained from a doctor. In addition to taking these precautions it would be advisable to get the water analysed from time to time.
 Blessings from
 BAPU
[From Gujarati]
 Mahadevbhaini Diary, Vol. I, pp. 323-4, and Bombay Secret Abstracts, Home Department, Special Branch, File No. 800(40)(3), Pt. II, pp. 403-5
 
         DEAR 	KAPIL,   LETTER TO KAPIL     July 	21, 1932 
  	Received your letter. I am sorry to learn of your health. I think 	you should quietly improve your health and while improving health 	whatever service you can render, be satisfied with that.libtech_433_footnoteTo ply a  takli is some service. Educate the 	children who may be in your vicinity or conduct night classes for 	those who are grown up. This is also service. We should purify 	ourselves as we advance in years and should not allow a single 	impure thought to enter our mind. This is, from my      Vol. 	I. 
 point of view, a service. And even a man on sick-bed can do this much.libtech_434_footnoteYou must indeed be observing the rules regarding prayers, etc. Do write to me.
 Blessings from
 BAPU
 Mahadevbhaini Diary, Vol. I, p. 323, and Bombay Secret Abstracts, Home Department, Special Branch, File No. 800(40)(3), Pt. II, p. 399
 
  LETTER TO HANUMANPRASAD PODDAR 
 July 21, 1932
 BROTHER HANUMANPRASAD,
 Received your letter as also your telegram today. I shall not feel anxious about Devdas since you are there. Moreover Devdas had written to me that you treated him in a very loving manner. The doctor is really a good man. I shall always expect to receive letters from you from time to time.libtech_435_footnote
 The man who resorts to falsehood with a view to acquiring worldly goods or for some other reason in full of attachment and hatred;  he  cannot  possibly  reach  God.libtech_436_footnotelibtech_437_footnoteAnd  I  consider  the  other example you have cited as impossible. To tread the path of truth and at the same time to remain aloof from worldly affairs, i.e., from  pravritti is a thing which is impossible like a flower in the sky. How can one tell what path one follows who keeps away from pravritti? To tread the truth in itself involves entrance into pravritti.  Without  pravritti there is no occasion for treading or not treading the path of truth. The holy Gita in its several verses has made it clear that a man cannot exist even for a moment without pravritti. The difference between a devotee and one who is not a devotee is this, that the first remains in pravritti with an eye to the highest good and while living in pravritti never lets go his hold upon truth and weakens attachments and aversions, while the other lives in a state of infatuation with
 
 Diary, Vol. I.
 pravritti and does not even try to remain aloof from such demoniac actions as falsehood, etc., while pursuing his object. These worldly affairs are not a thing to be looked upon with contempt. It is only through worldly affairs that a vision of the Lord is possible. Those worldly affairs that create infatuation deserve to be looked upon with contempt and always shunned. This is my firm opinion and experience.
 Blessings from
 BAPU
[From Hindi]
 Mahadevbhaini Diary, Vol. I, p. 323, and Bombay Secret Abstracts, Home Department, Special Branch, File No. 800(40)(3), Pt. II, p. 401
 
         BA,   LETTER TO KASTURBA GANDHI   [On or after July 21, 1932]libtech_438_footnote   None 	can say what the matter is that you do not receive 
  	my letters and I do  not  receive  yours?  Hence  I  have  not  	written any letters at  present.  When  it  is  not  certain  that  	letters  would reach  you  how  can  I  like  to  write?  I  do  	receive   information about you. Nimu writes to say that you appear 	to be losing strength. How is that? Is the food digested?  	We are happy here. You must be knowing that I am at present taking 	milk. There was no special reason fot taking it. The Superintendent 	here insisted and so I began to take it. I also take roti and 	vegetable. Vallabhbhai has begun to learn Sanskrit, and has also 	begun to work the spinning-wheel. There is uncertainty about my 	letters at present and so it cannot be said what the fate of this 	will be.  	Devdas has again fallen ill, but there is nothing to be anxious 	about.  	You may have known of the death of Rajaji’s son-in-law. If you 	have not written a letter of condolence, write one. Blessings to 	sisters.  BAPU  Bombay 	Secret Abstracts, Home Department, Special Branch, File No. 800      
 
 
 
 
 DEAR COL. DOYLE,
  LETTER TO E.E. DOYLE 
 
 July 22, 1932
  	I refer to my letter of 13th instant. My son at Gorakhpur too had a 	relapse. I have written to him a letterlibtech_439_footnotelibtech_440_footnotethat 	should cheer him. But I have no notion when it will be passed and 	sent to him. Another to a friendlibtech_441_footnotelibtech_442_footnotein 	the Lahore Jail. She has undergone an operation. A third to the 	sister of the missing Airman Jeejibhoi.libtech_443_footnotelibtech_444_footnoteFourth 	to Shrimati Mirabai Sladelibtech_445_footnotelibtech_446_footnotewho 	is down with fever at Benares. And I am writing today a postcardlibtech_447_footnoteto  a  girl  sending  her  and  her   people  	condolences  on  a family bereavement. All these letters to be of 	value should surely be sent at once or not at all. But from the 	manner in which the Ashram post is held up, how can I hope that the 	foregoing letters will be passed soon? I have a postcard from the 	Ashram telling me that my letter of 5th July was received there on 	20th instant! The letters writtenon the 12th and 19th July have 	still evidently not been sent. They contain important instructions 	about ailing inmates and others in distress that has nothing to do 	with political matters.  If  the Government do not wish to withdraw 	their orders conveyed to me about my letters, I should be assured of 	their quick despatch. This delay in sending my letters to their 	destination seems to me to be highly unjust to me and hardly 	becoming for the Government. I have willingly broken no rule about 	my correspondence. On the contrary I have tried to be meticulously 	correct in carrying out their instructions. I know no reason for 	this vexatious change in the disposition of my correspondence.  	Could you please forward this to the Government and ascertain their 	wishes in the matter? 
        Government 	of Bombay, Home Department, I.G.P. File No. 9  Yours sincerely,  M. K. GANDHI 
           in 	this valume, there is a reference to a letter to Shirinbai; but this 	letter is not available. Vide, 	however, “Letter to Shirinbai”, 26-7-1932.   
 
 
 
 
 CHI. ROHINI,
  LETTER TO ROHINIBEHN DESAI 
 
 July 22, 1932
  	I got a letter from Hamida today. She informs me that your maternal 	uncle has expired. All of you are being tested severely. Give 	condolences to Mother or behalf of all of us. Really speaking we 	should never grieve over death. If we regard death as a friend, then 	uncle has met a friend. We may, of course, mourn his death because 	of our selfishness. If, however, we look at the matter in proper 	light, it is our good fortune that all of us will meet that friend 	sooner or later. I have heard that Kanjibhailibtech_448_footnotelibtech_449_footnotealso 	feels weak. Write to me and give me detailed news. Sardar also is 	eager to know about his health.  Blessings 	from  BAPU  SMT. ROHINIBEHN  C/O 	SJT. 	KANAIYALAL 	NANABHAI DESAI 	GOPIPURA, SURAT  From 	a photostat of the Gujarati: G. N. 2658   
          DEAR 	NIMU,   LETTER TO NIRMALABEHN GANDHI   July 	22, 1932 
  	You seem to be a very cunning girl. After showing that you have no 	time left, you turn the tables on me and say that you would devote 	as many hours as I would ask you to devote. But I have already 	written to you that the care you take of children resembles  the 	Ashram work. It does not matter if no note can be kept of that. If 	from that half an hour even—not to say an hour—is spared, that 	also can be noted. There is no shame in it.  	If Hasu sends Vinay here [sic], then it will serve your 	purpose as well as mine. There will be two girls instead of one. The 	elder girl has children. But there are two conditions. Either 	Sumitralibtech_450_footnotemay 	commit theft and be convicted, appear in male guise, be big after 	being drawn though a machine and appear to be sixteen years of age 	or she should     
 have four instead of two legs and a tail! Then I may be permitted to keep a cat with four feet. Is Sumitra willing to become a cat with four feet and have a tail? If so, take medicine from Gangabehn who is going there, grow (additional) feet and tail and send (her).
 Continue   to   write   letters.	All   your	troubles	must	have disappeared.
 BAPU
 Bombay   Secret   Abstracts,   Home   Department,   Special   Branch,   File No.
 800(40)(3), Pt. II, p. 397
 
 
  LETTER TO NANDUBEHN B. KANUGA 
 July 22, 1932
 DEAR SISTER,
 
 When I was thinking of writing a letter to you, letters began to rain from you, maybe, on the Sardar. It may rain for any reason, but it must make all wet. The same is the case with us.
 I knew that you were of a humorous nature, but I knew only from your letter that you were overflowing with humour. You ask for my blessings, but they are always there.
 You have been encouraging the Sardar well, but he is not a soft Bania like me. When he is inspired with courage from the heart, then only he will do what he wants to do. That is the case. Now he is enthusiastic over the study of Sanskrit, i.e., he has fully devoted himself to it. But there is no one here who can take creditlibtech_451_footnotefor that. His teacher is Mahadev. In addition, comes the Gandiva spinning-wheel.
 \That also when it occurred to him. So the intentions you have formed to go shares with him are useless. Yes, you can take the share you want from his knowledge of Sanskrit. If you say, we may send the same by wire.
 What a shame that a doctor becomes toothless as I am. Tell Haribhailibtech_452_footnotethat [the question is] when doctors become ill in whom we should have faith.
 
 
 You and Lilavatibehn have lost, it seems, a good deal of your weight.
 Blessings from
 BAPU
 Bombay Secret Abstracts, Home Department, Special Branch, File No.
 800(40)(3), Pt. II, pp. 395-7
 
   LETTER TO RAGHAVDASJI     MAHARAJ 	RAGHAVDASJI,    July 	22, 1932 
  	I have received the book sent by you. I shall go through it when I 	get time. Ne review can be sent from the jail. I would, therefore, 	like to be excused.  Yours,  MOHANDAS GANDHI  Bombay 	  Secret   Abstracts, 	  Home   Department, 	  Special   Branch,   File No.  800(40)(3), 	Pt. II, p. 365   
         CHI. 	KAKA,   LETTER TO D. B. KALELKAR     July 	23, 1932 
  	I have received you letter after waiting for a long time. As it is 	heavily censored, I have not been able to get full news about your 	health. I have of course written to Colonel Doyle about your health. 	I have suggested to him that he should send you to me, in which case 	your health will of course improve and we could also study astronomy 	and even write about it.  	My suggestion is twofold. Either Shankerlibtech_453_footnoteand/or Ballibtech_454_footnoteshould be sent to you, or you should be sent to me. 	Shanker is here. He of course wishes to be near you and serve you. I 	have no direct communication from Bal but I keep getting news about 	him and the other boys. Someone or another writes from Visapur. About 	astronomy my intention and purpose was as you had     
 inferred. It was not in my mind that astronomy helps one to know the hour of the night by looking at the stars, nor was I thinking that the Vedic gods and goddesses are directly connected with planets, stars and constellations. I am familiar with Bhai Hiralal’s ideas. I have read all the articles he sent me. All that is interesting. But my interest is of quite a different kind.
 Looking at the sky  the  impression  we  get  of infinity,  of purity, of order and of grandeur is one that purifies us.  It  may perhaps be that on being able to reach the planets and the stars one will get the same experience of good and evil that one gets here on earth. But truly divine is the peaceful influence of their beauty and coolness at this great distance. Also when once we  are  able  to establish communion with the heavens it does not matter where we may happen to be. It then becomes like receiving the Ganga in one’s own  home.  All  these  thoughts  have   made   me   a   keen   watcher of the infinite skies. So I am acquiring knowledge of astronomy enough for my own satisfaction. At present I have gathered quite a collection of books on the subject. Professor Trivedi has sent me three bookslibtech_455_footnotelibtech_456_footnoteby James Jeans. Of them I have read the two bigger ones. I like them both. I have now started a systematic study of astronomy. At present I am reading a book by Kharas. The author, it seems, has taken a good deal of trouble over it. The book is profusely illustrated, which is great help. I find this book interesting because I have already read other books. Had I begun with this book I may not perhaps have liked it. No effort has been made to make it entertaining.
 I cannot, as yet, write to you about the kind of book on astronomy which I want in Gujarati, as my ideas on the subject are still taking shape; it would be neither easy nor desirable to indicate a framework at this stage.
 It is quite all right that your spinning is reduced. Nothing need be done at the risk of your health.
 Vallabhbhai has added to his work of preparing envelopes. He spins ten slivers every day on the Gandiva spinning-wheel and is immersed in the study of Sanskrit. We have sent for all the 24 parts of Satavlekar’s series. It is about a fortnight that he started the study and is already finishing the first three parts. This is really good progress. He will probably finish all the parts in four or five months. He aspires
 
 
 to know enough Sanskrit to be able to read the Ramayana and the
 Mahabharata.
 Mahadev has reduced his spinning by half. Too much time was taken up in spinning yarn of 40 counts. It was also very tiring for him. His yarn of 40 counts turns out to be very good.
 I can’t say that my left elbow is completely cured; but with the doctor’s permission I have gone back from the Magan spinning- wheel to the Gandiva. But I turn the wheel with my left hand and draw the thread with the right. I haven’t sufficient control of the right hand to draw a thread as fine as I would like to. But even then, the thread is finer than the one I could draw on the Magan wheel. My speed also has somewhat increased, and if my left elbow does not betray me, my speed must increase a good deal. I visualize a tug of war between my speed and the fineness of the yarn.
 These   days,  Satyagrahashramno  Itihas libtech_457_footnotetakes   up   my   time. I do not feel like writing anything else before the history is finished. The study of Urdu and of the currency problem and Swadhyaya Samhita are of course going on. I may not, therefore, be tempted to write on the characteristics of  daivi  sampatlibtech_458_footnotelibtech_459_footnote.  The  idea  is  yours and I think it is proper that you yourself should write on the subject.
