chapter_no,date,title,content
 I have fully understood your analysis of the reasons why you get angry. Try to overcome your weakness. I know that you will succeed in overcoming it. I understood your meaning in that part of your letter which you had decided not to leave out. You did right in not leaving it out. There is great pride in not explaining one’s need to a person whom one loves, it does him injustice and puts a heavy burden on him. Civility and humility on our part save him from the trouble of ascertaining our need. This is the first lesson in civility. Learn it now.
Write to Krishnan Nair and tell him that I often think about him.
 You did very well in going to Rajkot. It seems your health requires such rest.
 Public opinion means the opinion of that section of society for which we care. It is our duty to respect it so long as it is not against morality.
 It is difficult to come to a just conclusion on the basis of the incident about the dhobi. Such conduct would certainly not meet with our approval in this age. Anyone who abandons his wife because of such criticism would be regarded as a cruel and unjust man. But I am not in a position to say what the poet’s intention was in the Ramayana in narrating that incident. We need not bother about that problem. I would not. I do not read even works like the Ramayana from that point of view.
 I believe that I must stop taking the freedom which I do with the girls if that shocks the inmates of the Ashram. There is no reason which makes it a moral duty for me to take such freedom, nor does my taking it violate morality. If, however, my refraining from it was likely to have an undesirable effect on the girls, I would reason with the inmates of the Ashram and continue to behave as I have been doing. If the girls themselves do not leave me, I would have  to  consider how to meet the situation. In any case, no one should follow my example and take similar freedom with them. The freedom one takes should be spontaneous. No one should consciously and deliberately decide to take such freedom from one fine morning and behave unnaturally; it would be quite improper if anyone did so. Narandas is free to act as he thinks proper. I would not wish even to
 criticize him. The truth is that anyone who takes even the  most innocent freedom with impure feelings falls into a pit and also drags others behind him. As long as the relations of men and women have not become natural in our society, one should certainly be careful in one’s behaviour. There is no royal road in such matters which all can follow. There is a good deal of clumsiness in your own behaviour. Your innocence saves you, but it is certainly not proper for you to be proud of it and obstinately to persist in your behaviour. There is thoughtlessness in doing so. You do not see today the harm which such behaviour may do. But you way have to repent one day. No one’s pride has endured for ever. One should not deliberately try to shock society, arguing that all conventional restrictions are bad. Have you now some idea of what public opinion means?
 Write to Dhurandhar and tell him that he should bear in mind what the Major told him. He will himself have to become a walking advertisement for asanas.libtech_697_footnote
 BAPU
 From a photostat of the Gujarati: G.N. 10299. Also C.W. 5745. Courtesy: Premabehn Kantak
 
 
            CHI. 	PUSHPA,   LETTER TO PUSHPA S. PATEL   YERAVDA MANDIR,  August 	18, 1932 
  	You have drawn wonderful pictures. What are the gifts Mangala 	received? Who gave them? Are your trees alive? Your handwriting is 	improving. 
     From 	the Gujarati original: C. W. 11082. Courtesy: Pushpa Naik  BAPU 
                 went. 
  
         CHI. 	MIRA,   LETTER TO MIRABEHN     August 	19, 1932 
  	So you are again in your den.libtech_698_footnotelibtech_699_footnoteI 	hope you will regain your lost strength and vitality. And you will 	be anxious about nothing. Simply concentrate on your spinning and 	such studies as you can easily undertake. We are all doing well. 	Love from us all. God [be] with you.  BAPU  From 	the original : C.W. 6233. Courtesy : Mirabehn. Also G.N. 9699     LETTER TO GULAB   August 	19, 1932    CHI. 	GULAB,  	If the thoughts which come to you are good, you need not worry much 	about them. If they are bad, try to keep them out with the help of 	Ramanama and think only about your work. 
     From 	a photostat of the Gujarati : G.N. 1721  BAPU 
     LETTER TO PURUSHOTTAM GANDHI   August 	19, 1932  CHI. 	PURUSHOTTAM,  	I got a letter from you after a long interval. Do not worry if you 	cannot keep to the prayer hours in the Ashram. Both Jamna and you 	have weak health, and if a person cannot get up early in the morning 	he should not force himself to do so. The secret of being able to 	get up early is to go to bed early.  	I think that hip-bath, sun-bath, fruit diet and milk, only as much 	as one can digest, would be a sure remedy for anaemia. Open air also 	is essential.    
 The book on healthlibtech_700_footnotehas discussed only the diseases of which I had some experience.
 
    From 	Gujarati : C.W. 904. Courtesy : Narandas Gandhi  BAPU 
     LETTER TO NANALAL K. JASANI   August 	19, 1932  BHAI 	NANALAL,  	I was waiting for a letter from you as we wait for rains in the 	months of jeth and Ashadha. I remembered you 	immediately the day I received the cable about Doctor’s last 	sleep, and also wrotelibtech_701_footnotelibtech_702_footnoteto you. I even wished at that time that you were with 	me, but I did not know you were in fact so near me. I did not even 	know where you would be, and so I enclosed that letter and another 	for Khimchand with my letterlibtech_703_footnotelibtech_704_footnoteto 	Manilal. In my letter to you I asked for your help and in the letter 	to Khimchand I cautioned him. I mentioned my distrust of him and 	other people’s too, but told him that Doctor had great trust in 	him and expressed my hope that he would not betray it. Maganlal had 	written me two long letters about Khimchand about the time he went 	to England, and I had also written to Doctor on the basis of those 	letters. Doctor had assured me in reply that Khimchand had turned 	over a new leaf and that there was no ground for distrusting him. 	You should not feel any hesitation now in taking a hand in the 	affrairs of the family. It is your duty at this juncture not to wait 	to be asked to intervene. Doctor’s trust in you can be seen even 	in  his  last instructions. Chhaganlal writes to me. His letters 	have been very good. He has promised to abide by my advice. He has 	expressed his own views, too, but he does not insist on their being 	acted upon. My letters are not likely to reach there before the 13th 	[proximo].  Hence,  without knowing what I want he has sent me a 	copy of the note which you had sent [to him]. All the letters and 	cables which I have received up to date from Chhaganlal after the 	passing away of Doctor can be described as perfectly satisfactory. 	If he seems to have an ulterior motive behind them, you should guide 	me. I am proceeding with full      
 trust in him. Ratilal Desailibtech_705_footnotelibtech_706_footnotehas written to me and told me that he does not share my trust. I have as yet made no suggestions beyond asking him to bring the accounts up to date. For the present, I am collecting all the relevant facts. I sent wireslibtech_707_footnotelibtech_708_footnoteto Ratilal, Champa and Manjula and dissuaded them from rushing to Rangoon. I wished to restrain Maganlal too, but I knew that he would not have that much patience, and also that he did not trust Chhaganlal. My own attitude has been that the shares of the three brothers should be separated. From what Chhaganlal writes, Doctor’s property seems to be very much less than I had thought. He says that there is practically no cash, and also expresses his distrust of Mayashankarlibtech_709_footnotelibtech_710_footnote. I think we should treat the last instructions of Doctor as his will. If, however, the total property is as enumerated by Chhaganlal and if there is no cash, how can we pay immediately the sums specified by Doctor? Please write to me frankly and in detail about all these matters. I feel unhappy that I am in jail at this juncture. But our wishes are not always fulfilled, and, therefore, we should do our duty as best as we can in the circumstances in which we are placed.
 Blessings from
 BAPU
 From Gujarati : C.W. 9462
 
  LETTER TO BALKRISHNA BHAVE 
        CHI. 	BALKRISHNA,  YERAVDA 	 CENTRAL 	 PRISON, POONA  [Before August 20, 1932]libtech_711_footnote 
  	I was not at all vigilant. I could suspect others but I could not 	suspect you. Whether I was vigilant or not it was your duty to 	inform me immediately about the lapse. That way the lapse would have 	been to some extent remedied. But it is futile to think over the 	past.  	But now you should be able to sleep. Do not strain yourself to 	induce it. Sleep out in the open air. Be without any thoughts. Utter 	Ramanama if thoughts occur. If in spite of it, thoughts keep coming,       
 let that be so. Once you have decided that you must sleep then there is nothing to think about. Instead of worrying it is better to court failure. If there is discharge during sleep, do not fret. If you remain indifferent to it, I shall consider that you have learnt the lesson taught in the verse  If we have completely shut our minds to it, how are we responsible for an emission in sleep? All this can be addressed only to one following truth.
 You do not require wheat for putting on weight. However, do take it if you can digest it. If you find it difficult to digest wheat then take as much milk as you can and also fruit. For the moment do not think about the cost. Therapeutically milk and neem could be a complete diet, but this can be proved only by experiment. If you call free yourself from there I would like you to go to Almora for a few months. Discuss it with Vinoba.
 To show you how Suraj Bhan had a break-down, I send herewith his letter.
Now for the questions. I take it you have these with you.
  Yes 	and No. Because I 	am myself not 	clear as 	to what activity 	goes on for 	the whole day.  Both 	are alike, so 	I have 	not made an effort 	to find 	out the difference. 	There is scope 	for wide 	difference where the 	word ‘like’ is 	used. There is a 	great difference between 	the statements: 	‘gold is like 	brass’ and 	‘gold is 	brass’, and 	similarly between ‘a 	rope is 	like a snake’ 	and ‘a 	rope is 	a snake’. 	The first 	is a 	beautiful example of eloquence but 	is meaningless 	as usage. 	There is no eloquence 	in the 	second. There can 	be many usages. The 	reply to 	the first 	question covers that to 	the third.  Both 	the activities are different; 	so there 	can be no 	comparison. Only 	an experienced 	person can say more.  The 	brahmi state 	is positive, 	it is an affirmation. 	But it 	cannot be described as 	it can only 	be experienced. 
 ‘Sensitive’ means delicate and soft. It is good you introduced the children to me. A letter to them is enclosed.
 Blessings from
 BAPU
 From the Gujarati original: C. W. 11279
  
   LETTER TO JANAKIDEVI BAJAJ  
 August 20, 1932
 CHI. JANAKIMAIYA,
 So at last you took the trouble to write a few lines with pencil. It seems you could not shake off your lethargy even in jail. I think it was a mistake [on the part of the magistrate] to have awarded you ‘A’ class. He should have awarded you ‘C’ class, so that you would have had to do hard work. Well, be as lethargic as you will, but see now that you recover your health completely. I am glad you are having an experience of Vinoba’s strict discipline. If you do not write regularly, bear in mind you will be punished. Did I tell you that the old blanket which you had made into a new one by stitching it on to khadi cloth had accompanied me to the Royal Palace?libtech_712_footnoteAnd it is with me in this jail, too. I am sure it will last for many more years yet.
 Blessings from
 BAPU
 From a photostat of the Gujarati : G.N. 2900
 
        CHI. 	LILAVATI,    LETTER TO LILAVATI ASAR    August 	20, 1932 
  	You must have got my message. I hope you have calmed down now. 	Remember the second chapter [of the Gita].  	It seems best to me that you should entrust your money to the care 	of Narandas and let him make any arrangement about it which he 	thinks proper. You should know from him what arrangement he makes. 	Obtain receipts, etc., and preserve them, or give the original 	receipts to Narandas to preserve. You should consult Narandas 	himself for further guidance in this. I am writing to him. From here 	I cannot think of any other suggestion to make. I hope your health 	is all right. Send me a report of your work.  Blessings 	from  BAPU  From 	a photostat of the Gujarati : G.N. 9570. Also C.W. 6542. Courtesy: 	Lilavati Asar    
  
   LETTER TO CHHAGANLAL JOSHIlibtech_713_footnote  
 August 20, 1932 One of the many causes of illness is impatience. First the mind becomes   impatient,   and   then   the   body.  But   it   is   the universal
experience that ‘the impatient get nervous and the calm remain self-
 possessed’. If the world is on fire, will impatience help us to put out the fire? And is it for us to put out the fire? Do you know that firemen do not shoot water at the raging flames when a great fire breaks out? They direct their attention to the parts round the flames. If they can save them, they should be regarded as efficient, that is, as [karma] yogis. If we do our own duty well, we would in effect have put out the fire. It may not seem to the physical eye to have been put out, but you may rest assured that it has been put out. My long search for truth has revealed to me no other way but this, nor is it likely to reveal any other in future. If what I have said is not correct, it would become impossible to follow the path of truth and cling to it scrupulously. We can insist only on that which is possible. If anyone demands air of the mountains on the moon, we would have to call him a Shaikhchallilibtech_714_footnotelibtech_715_footnotefor his desire can never be satisfied. And this is also true about the scope of our duty. Really speaking, everyone’s duty is clear enough for him to see, for one does not have to look far to find it. One has to look no farther than the tip of one’s nose. We have merely to clean the dirt immediately in front of our feet. As we clean it, we shall discover more dirt to be cleaned and will clean that too. It does not matter that, at the end of our lives, there will be as much dirt to be cleaned as when we started. In truth, however, can we say that life ends? The body perishes, but does that matter? And if life does not end, we should not feel disheartened to discover that the dirt has not disappeared. A  tailor’s son goes on stitching all his life. If he falls dead with a yawn, a needle in his hand, he would be a man of true devotion to duty.
[From Gujarati]
 Mahadevbhaini Diary, Vol. I, p. 371
 
 
 
   LETTER TO KASTURBA GANDHI  
 August 20, 1932
 You will soon be released now. But you will feel unhappy that you cannot see me. I also feel unhappy. I may feel tempted to relax for your sake at least. But you also will agree that it would not be proper for me to do so. We have become what we are through self- sacrifice. You should, therefore, show patience. Write to me in detail.
[From Gujarati]
 Mahadevbhaini Diary, Vol. I, p. 373
 
   LETTER TO BALKRISHNAlibtech_716_footnote  
 August 20, 1932
 I do not know with certainty what Shankaracharya meant by maya. This is what I believe. The world which we see and believe in is mere appearance; it is a product of our imagination. But in its true essence it does exist. We do not know what that essence is. We say that  it is Brahman, but we characterize all descriptions of the latter as inadequate. The world also a Brahman and not different from it. The difference which we see is mere appearance.
 My view is that the span of our life can be lengthened or shortened. The truth is that every species is born with its natural functioning determined. We do not know and need not know what they are.
 The divisions of time are man-made and they are smaller even than particles of dust in the cosmic cycles of time. Even if crores of units of our time as big as the Himalayas were added together, the total would be smaller than a cosmic cycle of time. It is very little, therefore, which man commands. Let him be pleased with it as much as he will.
 There are innumerable physical causes of dreams. I have expe- rienced that, while dreaming, we can be conscious of its unreality. Such a moment may possibly be the point of transition from the dream state to the waking state. Involuntary discharges are sometimes the result of purely physical causes and take place  even  without impure thoughts in one’s mind. They can be stopped by changes in one’s food. Mostly they are caused by constipation. When such
 
 discharges are due to milk, mostly the immediate cause is impure thoughts, since milk has a tendency to stimulate passion. But that is not the case with you. That is, milk cannot stimulate passion in  persons whose bodies have become weak even if the person is of a passionate nature. All the power of the milk is used up in building the body of such a person. Dr. Rajab Ali’s view is correct within certain limits. But what he says does not apply to persons who are completely healthy in body and mind.
 The desire to work for the welfare of the world is an essential element in the nature of a man of spiritual knowledge. There can be no exception to this.
 I cannot say for what length of time I can keep out all thoughts from my mind, since I have never tried to test this. But I know that I am able to keep out unnecessary thoughts. If any such thoughts come, they have to run away like thieves.
 Hypocrisy is nothing but the mask which falsehood wears. [From Gujarati]
 Mahadevbhaini Diary, Vol. I, pp. 371-2
 
   LETTER TO MATHURADASlibtech_717_footnote  
 August 20, 1932 The plan of voluntary dress-making for yajna is not intended to provide the work of stitching khadi clothes for the poor. The idea
 behind it is to promote quicker sale without incurring loss, of khadi woven by the  poor  and  to  reduce  its  price  which  is  felt  to  be  high libtech_718_footnote
 Do not pay attention to carnal thoughts either. Once we have made up our mind in regard to a thing, we should take it as finally settled. A vow means that the mind stops thinking about the thing concerning which we have taken the vow. When a business man has concluded a deal, he does not think further about it and directs his attention to other things. We should act in the same manner with regard to vows.
[From Gujarati]
 Mahadevbhaini Diary, Vol. I, pp. 372-3
 
 
 
 
 
CHI. MADALASA,
   LETTER TO MADALASA BAJAJ  
 August 20, 1932
  	I got your letter. You may believe that you are full of envy, pride, 	etc., but I don’t believe so. From whom could you have got these 	defects? Jamnalal certainly does not have them, nor Janakibehn. You 	have also not come under the influence of bad company. And there is 	nothing you lack. Yes, you are inclined to be angry. I, too, 	observed that. But Janakibehn also has that weakness. And, moreover, 	your body is weak. But you are wise. Make a conscious effort, 	therefore, to overcome your shortcoming. Other people also are human 	beings like us. The same atman dwells in all of us. Hence, 	getting angry with anybody means getting angry with ourselves. 	Moreover, no short-comings remain in anyone in whom a passion for 	the service of every living creature has been aroused. You should, 	therefore, cultivate greater devotion to service. It 	will make me happy if you write to me regularly.  Blessings 	from  BAPU [From 	Gujarati]  Panchven 	Putrako Bapuke Ashirvad, 	p. 313   
         CHI. 	OM,    LETTER TO UMADEVI BAJAJ    August 	20, 1932 
  	I got your letter. Your handwriting has improved greatly. If your 	present weight is due to a strong build, why do you wish to reduce 	it? You will be better equipped for service if you grow up to be big 	and strong in body, provided of course that your mind also becomes 	strong along with the body. If the body has become merely fat 	because of some disease, you should certainly try to reduce your 	weight. Do you suffer from any disease? Write to me from time to 	time.  Blessings 	from  BAPU [From 	Gujarati]  Panchven 	Putrako Bapuke Ashirvad, 	p. 335 
  
   LETTER TO GULAM RASUL QURESHI  
 August 20, 1932
 CHI. QURESHI,
 I got your letter. Since the children feel at home at Noorbanu’slibtech_719_footnote, we may be satisfied that their interest will be well protected.
 Improve your health. If your piles can be cured with treatment it would be very good. Do not be impatient.
 I have received two parts of Safaba, the first part of Sirhat and Al Farooqui. I have not received anything else. With whom did you send the Koran? I must get the second part of Sirhat and the second part of Shibli. What is your weight now?
 Blessings from
 BAPU
 From a photostat of the Gujarati: C. W. 10808. Courtesy: Gulam Rasul Qureshi
 
   READING AND REFLECTION—IIlibtech_720_footnote  
 August 21, 1932
 Awake and arise, O traveller, it is morning now; It is no longer night that you still slumber.libtech_721_footnote
If   anybody  understands   these   lines   to   mean   simply:   “O  
 traveller, arise, it is morning now. Is it night that you are still sleeping?”—then he has read the lines but not reflected over their meaning. For such a reader will rise early at dawn and feel satisfied. But a reader who wishes to think will ask : Who is this traveller? What is meant by “It is morning”? What does the poet mean when he says that it is no longer night? What does sleeping mean? He will then discover daily new meanings in every line, and understand that the traveller represents every human being. For one who has faith in God, it is always morning. Night may also signify ignorance. This line applies to any person who is negligent, be it in ever so small a degree. Anybody who tells a lie also slumbers. The line is a call to such a
 
 the following item.
 
 person to wake up. We may thus read a wide meaning in the line and learn peace of mind through it. In other words, meditation on this single line can supply enough provision to a man for his spiritual journey, whereas a person who has memorized the four Vedas and also studied their meaning may find them a useless burden. I have given here but one illustration which occurred to me. If all of us decide in what direction we wish to progress and start thinking, we would discover new meanings in life and daily experience a new joy.
 From a microfilm of the Gujarati : M.M.U./II
 
   LETTER TO NARANDAS GANDHI  
 August 20/21, 1932
 CHI. NARANDAS,
 I got your heavy mail. There was a bitter letter from Champa. I immediately wrote a postcard in reply, which you should get  on Sunday or Monday. Now that Narmada has been saved, we owe an especial duty to her. I think her education has been poor. Her handwriting is extremely careless. If she has the good fortune now to observe brahmacharya for the rest of her life, I think she will have to know things. See, therefore, if you can give her more help (by way of time) and educate her. If she does not work with sincere enthusiasm to make good use of the time which you give to her, you may stop the help. About Liladhar, what you have done seems all right. If you can, try and make Jaisukhlal’s daughters forget Amreli. What is the name of Indu’s maternal uncle? What is his occupation in Palitana? Kusum cannot take up nursing as long as she is not completely free from the danger of tuberculosis. It would be very bad if she joins and returns in a month or so. She ought to realize that nursing is a very strenuous work. A sincere nurse has to be on her feet the whole day. She can hardly find time even for a hurried meal.
 Ratubhai’s condition is pitiable. Why does he let his children remain in college when he is in debt? I can easily see that he will not be able to go to Rangoon. Will not any of his children be ready to come and stay in the Ashram? A boy who is truthful, industrious and healthy can rise as high as he wishes in the Ashram. May be he will not get there the education which he gets in a college. But, after all what is the value of that education?
 You are doing a very good thing in keeping Ratilal from going.  I had fine letters from Chhaganlal, so that I am now relatively free
 from worry from that source. I got letters from Nanalal and Manilal, too. Manjula has been writing regularly. She is rising higher in my esteem every day.
 I have been having novel experiences in regard to my food. Eating bananas did not cure my constipation completely as long as I was drinking milk. I, therefore, stopped milk and ate bananas only for some days. For the evening meal I had bread and vegetable. This relieved the constipation to some degree. But, being eager to eat the same food as ‘C’ class prisoners do, and remembering that in 1930  I had tried rotlas of bajri and that had cured my constipation, for the
