chapter_no,date,title,content
1,"June 16, 1932",[PS.],"
    In 	the envelope you will admire Vallabhbhai’s art.  From 	the original: C.W. 6225. Courtesy Mirabehn. Also G.N. 9691       BAPU 
  
  LETTER TO NARAYANAPPA 
 June 16, 1932
 There is nothing like finding one’s full satisfaction from one’s daily task however humble it may be. To those that wait and watch and pray, God always brings greater tasks and responsibilities.
 Mahadevbhaini Diary, Vol. I, p. 223
 
  LETTER TO PARASRAM MEHROTRA 
 June 16, 1932
 CHI. PARASRAM,
 I have not yet received your booklet. Mahadev will go through the Press cutting. Do something about the swellinglibtech_11_footnoteand cure it.
 You did quite right in not running up to Vimal’slibtech_12_footnoteelder brother, but you yourself should feel so. The knowledge that he is under the care of your brother and that the latter is looking after him properly should be enough for you. If you have some special remedy for his illness or if you think that your very presence will cure him, then it may be your duty to go. That is, if you can become free from your work you should go in such circumstances. You should go, however, not only for the sake of Vimal’s brother but for any person who may be ill and whose illness is likely to be cured by your presence. It is only thus that one learns to overcome the weakness of one’s heart. Let us hope that the child is all right now.
 I think that it would be desirable to fix the maximum number of hours for work, it that is possible. But it seems to me that the limit would be different for each person. In an institution in which all the members regard one another as members of a family and everybody has the same sense of responsibility, it would not only be impossible, but may even be improper to fix a uniform limit for all. How can weframe a rule which would not permit a person, whose health is good enough, who is himself willing and who has no other work of service to claim his time, to give all his time to the service of the institution? The conclusion which I draw from this is that, if we exercise discretion
 
 in all our work, do it calmly and selflessly and without hurry, no one would feel the burden of work. We feel work to be a burden only when we do it under compulsion. Work done willingly and cheerfully is never felt as a burden. But those who have a demoniac nature are impelled by their selfishness to take all manner of work from their body and then break down. Such persons have no peace of mind and we should never take them as examples.
 The line about women which you have quoted has no other sense but what I have explained.libtech_13_footnoteIt is true only for lustful men. There is no injustice in saying that for immoral men, women are a mine of evil, just as for the greedy, a mine of gold is like hell. For the world, however, it is not so. Gold is useful in many ways."
2,"June 	16, 1932",[PS.],"
           I 	was glad to hear that the child was all right.libtech_14_footnote  BAPU 
  From 	a photostat of the Gujarati: G.N. 7502. Also C.W. 4979. Courtesy: 	Parasram Mehrotra     LETTER TO VITHALDAS JERAJANI   June 	16, 1932    BHAISHRI 	VITHALDAS,  	I got your two letters. The X-rays seem to have had miraculous 	effect on you. Your health should improve repidly now. But it may be 	wrong to believe that, because the rays have proved beneficial in 	one disease, they would help in my complaint too. They may or may 	not. Here in the prison my body is in the hands of the 	Superintendent. Let him take such measures as he thinks may help. 	They seem to have no fear and believe that the pain in the elbow 	will disappear if it is givencomplete rest. The pain is not 	continuous. The elbow pains only when I do a particular type of work 	with the arm.  Blessings 	from  BAPU  From 	a photostat of the Gujarati: S.N. 9782     
  
          CHI. 	DEVDAS,   LETTER TO DEVDAS GANDHI     June 	16, 1932 
  	I did fear some such thing. I had a feeling the day before yesterday 	that there would be bad news from somewhere. And then I got your 	wire yesterday. I immediately asked Vallabhbhai what the wire 	contained, and on opening it he read the news about your illness. It 	was not likely that you would escape fever in Gorakhpur. But I 	assume that it will have left you before you get this letter. I 	think that, according to your nature, you would like to be 	surrounded by friends and relations at such a time. You would 	deserve such care becuase you have looked after many people in their 	illness. But I myself am a hard-hearted man. I, therefore, would not 	like to ask anybody from the western part to run up to Gorakhpur. 	And if I did feel such a wish, I would suppress it. If I don’t 	practise my philosophy on you, on whom else should I? I wish that 	you should understand this nature of mine and bear it cheerfully. 	God is your relations and your friends and your parents; all others 	are so only in name. Themselves helpless creatures, how can they 	help you? Instead of lookiing to such cyphers for protection and 	support, seek the protection of the Universal Power. He will send 	you such help as He wills. It is my firm faith that, wherever you 	are, you will draw your neighbours towards you. There is no reason 	to believe that it will be otherwise in jail.  	After saying this, I suggest that, if you want anybody from the 	Ashram to be near you, send a wire there. But my hope is that by the 	time you get this letter your illness will have been a thing of the 	past.  	You always have the blessing of us all.libtech_15_footnote[From Gujarati]  Mahadevbhaini 	Diary, Vol. I, p. 220              
  
  A LETTERlibtech_16_footnote 
 June 16, 1932
 The story about the snake is correct only to a certain extent. The snake was passing over my body. At such a moment what could I or anyone else do except to remain still? I don’t see that this deserves any such praise as the writer has given me. And how do we know if the snake was poisonous or not? Having held for years that death is not a frightening event I am not affected for long by the death of anyone."
3,"June 	17, 1932","[From
Hindi]","
 Mahadevbhaini Diary, Vol. I, p. 224
 
         MY 	DEAR AMTUL,   LETTER TO AMTUSSALAAM     June 	17, 1932 
  	I have your letter. I am glad you are staying with your people. I 	have not yet been able to write to Dr. Sharmalibtech_17_footnotelibtech_18_footnote. But I will do so earlylibtech_19_footnoteIf the door to interviews in again opened, you shall 	certainly come and see me. Are you reading anything? Give me your 	day’s diary. Do write something always in Urdu. Love.  BAPU  SHRIMATI 	AMTUL 	SALAAM 	42 GHOD 	BUNDER 	ROAD 	SANTA 	CRUZ B.B.& 	C.I. RLY.   From 	a photostat: G.N. 251               
  
          CHI. 	PREMA,   LETTER TO PREMABEHN KANTAK   June 	17, 1932 
  	What else am I to believe but that you are a fool? If children have 	no interest in asking questions and still write, they waste their 	time. If they write with interest, though merely as a formality, 	there is some meaning in that. Children may not expect letters from 	parents, but are bound to be glad when they get one. There will be 	no trace of selfishness in this. In any case, you cannot see in this 	evidence of hysteria. I have explained to you in one of my letters 	what your hysteria is.libtech_20_footnote  	I have not opposed contemplation of a personal form at the time of 	prayers, but have given a higher place to the formless. Perhaps it 	is not right to make such a distinction. What suits one person will 	not suit another. Comparison is out of place in this matter.  For  	me  worship of the formless has greater appeal. Your explanation 	regarding Sankara and Ramanuja does not  seem  correct.libtech_21_footnotelibtech_22_footnotePersonal 	experience is more important than the influence of external circums- 	tances. The latter should have no effect on a votary of truth. He 	ought to see beyond them. We often see that opinions formed on the 	basis of external circumstances are afterwards discovered to be 	wrong. The connection between the atmanlibtech_23_footnotelibtech_24_footnoteand 	the body is a well-known instance of this. Because the atman is 	intimately connected with the body in this life, we cannot easily 	think of it as distinct from the body. No one has equalled the power 	of vision of the person who saw beyond this outward fact and first 	uttered: “Not this”. You will be able to think      towards 	God had changed 	with the change 	in social 	and political 	conditions. Sankara lived 	in an age of freedom when people talked of equality with God; 	Ramanuja lived in an age 	of slavery 	when people talked of 	being the 	slaves of 	the slaves 	of God. 	In the 	book Bapuna 	Patro-5: Ku. 	Premabehn Kantakne, 	pp. 99-101, 	however,  the 	addressee, presumably relying on 	her memory, 	says that she 	had argued that both 	Sankara and 	Ramanuja could attain 	greater heights of 	spirituality because they 	lived in 	an age of 	freedom where as 	the later 	saints, being born in 	slavery, worshipped 	personal gods and 	not the abstract Brahman.  
 of any number of such instances. It is not at all proper to take literally the utterances of Tukaram and other saints. Recently I read one such utterance of Tukaram. I quote it for your benefit.
 An image of Lord Pashupati is made out of clay: what, then, would clay called?
 The worship of the Lord reaches unto Him, the clay remains clay.
 An image of Vishnu is carved out of stone, yet the stone does not become Vishnu.
 The devotion is offered to Vishnu, the stone remains a stone.
 From this, I draw the lesson that we should pay attention only to the idea behind the words of such saints. They may describe personal God and yet worship the formless. We ordinary human beings cannot do that and, therefore, we would come to grief if we do not try to understand their real meaning and guide ourselves by it.
 If a person who can read Urdu goes to Imam Saheb’s house, he will soon find the books. You have there Mirabehn’s Urdu-English and English-Urdu Dictionary. Send that, too, along with the other books. Does anyone clean Imam Saheb’s house periodically? Every unoccupied house should be cleaned once a week or a fortnight.
 You will find it difficult to keep an account of time only till it has become a habit with you to do so. Afterwards, it shouldn’t take any time. Such things have a value and bear fruit only if they are done in the right spirit.
 I cite the example of children in South Africa in order to encourage the children in the Ashram and not to find fault with them. These children, too, are capable of working, if we have anyone among us who knows how to take work from them. Aren’t you there?
 For the pain in your back, you should sit in warm water. You should do that for fifteen to twenty minutes. At the same time you should massage the back with your palm. If you do this, your pain will be cured and there will also be a  beneficial  effect  on menstruation. Let me know what the doctor says. Such diseases should be effectively treated at the very first appearance of their symptoms.
 I carefully examined your daily programme of work. It is much too heavy. You can easily make a few cuts in it. From 12.30 to 5.40 you run a class and give instruction in crafts. That comes to five hours and ten minutes. If you reduce this period by one hour, you will get the free time which you need. You may retire into privacy and
 have a nap or simply lie down for one hour, or do some work which makes you feel that you are resting. You should not, however, spend the time in talking or in any serious work. If you do not wish to utilize the free hour just then, you may advance the time of those items of the programme for which it is convenient to do so and get an hour in the evening. Anyone who feels completely absorbed in his or her work does not feel it a burden or a strain, but to one who feels no interest in his work even a small task seems heavy, as a day seems as long as a year to a prisoner. To a person given to worldly enjoyments,  a year seems as short as a day!
 In the past, I used to get bored when listening to European music. It is only now that I can understand and enjoy it a little.
 You are not right when you say that “one should not hope to do any reading here.” It is quite true that you cannot do much reading. It is equally true that reading is given less importance in the Ashram. Even so, many prisons in the Ashram have been able to do some reading. I do not like your expressions of  despair.  Try  to perfect what you find imperfect. If, however, on the balance you feel that things are unsatisfactory, if, that is, after weighing the good points against the shortcomings, you feel that the latter exceed, you should leave the Ashram. Justice to oneself and to society requires that.
 You need not apologize for your long letters. They don’t bore me; on the contrary, I like them. I learn something from them, for each of them mirrors the state of your heart at the time of writing it.
 BAPU
 From a photostat of the Gujarati: G.N. 10290. Also C.W. 6738. Courtesy: Premabehn Kantak
 
        CHI. 	MOHAN libtech_25_footnote,   LETTER TO MOHAN N. PARIKH     June 	17, 1932 
  	Your letter was well written. Try to write still more neatly. I am 	glad that you do cleaning work and carding.  BAPU  From 	a photostat of the Gujarati: S.N. 9180      
  
  A LETTER 
 June 17, 1932
 You ought not to lose your self-confidence. One often gets impure thoughts. But those who frequently clean out the dust that daily settles in their houses may be said to be clean and keeping their houses clean. Similarly, those who drive out impure thoughts from their minds as soon as they come are sure to win in their struggle. They should not be called hypocrites. To save oneself  from hypocrisy, I have already suggested a golden rule, which is that one should speak about one’s impure thoughts and never hide them. Of course, you need not trumpt them in public. But you should certainly tell some friend about them. And, indeed, you should be mentally prepared not to mind even if the whole world knew about them. Have faith in the words of Vinoba and do not yeild to despair.
[From Gujarati]
 Mahadevbhaini Diary , Vol. I, p. 226
 
  LETTER TO CHHAGANLAL JOSHIlibtech_26_footnote 
 June 17, 1932
 I, for one, daily realize this truth from experience, that Nature provides for the needs of every living creature from moment to moment, and I also see that, voluntarily or involuntarily, knowingly or unknowingly, we violate this great law every moment  of our lives. All of us can see that, in consequence of our doing so, on the one hand large numbers suffer through over-indulgence and, on the other, countless people suffer through want. Our endeavour, therefore is to save mankind from the calamity of widespread starvation on the one hand and, on the other, destruction of food-grains by the American millionaires though a false understanding of economic laws. It is true, of course, that it is impossible at present to live in perfect conformity with this natural law. But that need not worry us.
[From Gujarati]
 Mahadevbhaini Diary, Vol. I, p. 224
 
  
            CHI. 	PUSHPA,   LETTER TO PUSHPA S. PATEL   YERAVDA MANDIR,  June 	17, 1932 
 Your 	Hindi letter is beautiful. Have you written it yourself?  	Consult Premabehn about sitting on the swing  during  the rains. It 	is very good that you are reading Vishal Bharat. 
     From 	the Gujarati original: C. W. 11080. Courtesy: Pushpa Naik  BAPU 
   
            CHI. 	VIDYA,   LETTER TO VIDYA HINGORANI       Y. M.,  June 	17, 1932 
  	I have your letter. To you household work is also service, because 	you are not attached to it. Since it is the only duty for you at 	present, you should derive perfect joy out of it. Never allow your 	health to suffer. Give 	my blessings to Anand.  Blessings 	from  BAPU  From 	a microfilm of the Hindi. Courtesy: National Archives of India and 	Anand T. Hingorani     A LETTERlibtech_27_footnote   June 	17, 1932  	Nothing as regards the conduct of prisoners can be sent from here 	for publication. As you say clarification on this point is desirable 	but that must await a suitable opportunity. I appreciate your 	argument against fetters. However I still think that the distinction 	between ordinary and political prisoners is invalid. There is need 	for reform in    
 the administration of prisons. A prison should be a  house  of correction and not punishment. If that is so, why should a forger have fetters on his legs in prison? The fetters will not improve his character. To my mind it is intolerable that anyone should be fettered if there is no likelihood of his trying to escape or becoming unmanageable or wishing to make a nuisance of himself. But if a political prisoner is an athlete like you, always thinkinig out means of escape and unable to control his tongue and hands, it will be the duty of the authorities to put him in fetters. In short what I mean is that the discrimination between political and other prisoners is not justified. We reformers should not seek for any concessions which cannot be justified on ethical grounds and are not granted to all prisoners in the same category. I should be unbale to stand an arrangement by which wheat  is given to politicals and maize to ordinary prisoners. Wheat bread must be issued to a prisoner who is unable to digest maize even if he is a murderer. And a political prisoner who has splendid digestion must give up wheat and ask for maize, and thus protect his fellow-prisoners. But these are only my views upon which I must not insist from where I am. Let each follow the dictates of his own conscience.
[From Gujarati]
 Mahadevbhaini Diary, Vol. I ,pp. 226-7
 
  TELEGRAM TO SIR MALCOLM HAILEYlibtech_28_footnote 
 HIS EXCELLENCY GOVERNOR UNITED PROVINCES
 June 18, 1932
 OVER    THREE    MONTHS    AGO    MY     SON     DEVDAS     WAS     TRIED     DELHI AND MEERUT AS CIVIL RESISTER AND SOMETIME AFTER CONVICTION TRANSFERRED     GORAKHPUR      JAIL.      GORAKHPUR      CLIMATE    NOTORIOUSLY
 was received yesterday: ‘The maximum tempreature was 102libtech_29_footnote, and has now gone below 100libtech_30_footnote. The climate of Gorakhpur is very bad       ’ Bapu remarked that Devdas
 had referred to the climate in the expectation that we should try to get him transferred from Gorakhpur. The Sardar suggested that he should certainly be transferred to some place with a better climate. Bapu said, ‘Yes, but we must apply for the transfer ourselves, if we want it, and I have no mind to do so. Harilal was in the worst prison  in South Africa, but his transfer was arranged by him himself and not by me’. The Sardar said, ‘But we are not prisoners here. The circumstances in India are different. Let us apply by means.’ Bapu yielded after all and wired to Hailey. ”
 MALARIAL.   CAUSE   FOR   REMOVAL    COMPANIONLESS    TO    SUCH    OUT    OF THE     WAY     JAIL     UNKNOWN.     HE     IS      SUFFERING      FROM      SIXTH INSTANT    FROM    SUSPECTED     MILD     ENTERIC     THOUGH     HE     SEEMS     TO BE     RECOVERING.     REQUEST     HIS     REMOVAL      TO      HEALTHIER      AND MORE    ACCESSIBLE    PLACE    PREFERABLY     TO     DEHRADUN     TO     JOIN  PANDIT   JAWAHARLAL   WITH   WHOM   HE   IS   CLOSE   FRIENDS   OR   TO YERAVDA TO JOIN ME IF REMOVAL HERE AT ALL POSSIBLE.
 M. K. GANDHI
 PRISONER, YERAVDA CENTRAL PRISON
 
 Bombay Secret Abstracts, Home Department, Special Branch, File No. 800 (40)(3) Pt. I, p 283
 
         DEAR 	COL. DOYLE,   LETTER TO E.E. DOYLE     June 	18, 1932 
  	In continuation of my letter of the 9th instant regarding Shrimati  	Mirabai  (Slade)  I  now  enclose  her   original   letterlibtech_31_footnotedated Bombay, June 14, 1932 (placed below), just 	received in reply to my enquirylibtech_32_footnote. In my opinion, the   precise language of this full 	letter is conclusive answer to the statement that she was “actively 	engaged in the furtherance of the civil disobedience movement”. I 	think that Government should be in possession of this emphatic 	denial of the information before them in connection with her doings 	before her incarceration. To save time I have marked the relevant 	portions of the letter.  Yours Sincerely,  M. K. GANDHI  Bombay 	  Secret   Abstracts, 	  Home   Department, 	  Special   Branch,   File No.  800(40)(2) 	Pt. I. p. 115                 
  
   LETTER TO KUSUMBEHN DESAI     CHI. 	KUSUM (SENIOR)libtech_33_footnote,    June 	18, 1932 
  	I got both your letters. You cannot come to see me till the 	restriction on Mirabehn is lifted. Isn’t that what self-denial 	means?  	We shall not do justice to Harilal if we do not publish his letters 	to you. Surely it was no fault of his that you could not live up to 	his ideals. You should do so now. You ought not to withhold the 	letters in order to hide your weakness. But why should you despair 	and feel weak? Or is it, rather, that you think you are too old? How 	can you give up hope at the age of twenty-four or twenty-five? In 	fact this is the time of life when you can strive and rise. Take 	Care!!! 
    From 	a photostat of the Gujarati: G.N. 1840  BAPU 
   
         CHI. 	SUSHILA,   LETTER TO SUSHILABEHN GANDHI   June 	18, 1932 
  	I hope you got my letter. When I wrote it, I believed that Manilal 	must have left. It must indeed have been an ordeal for you all. But 	that is how we are really tested. I hope that no effects of illness 	are left now. Did you have to call in a doctor, or did you try only 	common remedies? How do you help in the press?  	I assume now that Manilal also will remain there. Do not feel 	unhappy about that. We should live as God ordains. Our wishes are 	not always fulfilled.  	Sita is now growing up. Do you teach her anything? Has your hearing 	improved?  	Ask Pragjilibtech_34_footnoteand 	Parvati to write to me. All three of us will be glad to get their 	letter. Will Pragji stay on there now? I would be happy if you cease 	being lazy in writing to me and make your letters full of news. But 	you are daughter of a big man and I can’t take you     
 to task if you don’t do that. And, moreover, it was Jamnalalji who arranged the marriage. If you were daughter of an ordinary man, I would have forced you to write long and detailed letters !!!
 Blessings from
 BAPU
 From a photostat of the Gujarati: G.N. 4789
 
         CHI. 	MANILAL,   LETTER TO MANILAL GANDHI     June 	18, 1932 
  	I got your letter sent with Medhlibtech_35_footnote. I don’t think I shall be able to see him. In the 	first place, as Mirabehn is not permitted to see me I have stopped 	seeing any visitors. And, secondly, the name of every intending 	visitors has to be sent to the Government and Medh’s name is not 	likely to be approved. Even if he is permitted to see me, I don’t 	think we would be allowed to discuss the affairs of South Africa. In 	the letter asking for the permission, he should state as the reason 	his intention to discuss them. If I see him then, there would be no 	need to send a cable to you. But I did not have even a letter from 	Medh. He can at any rate write to me.  	So you were all attacked by the virulent fever. In the absence of 	any news by cable, I assume that all of you are well. I approved of 	Sushila’s and Sita’s staying on there because I thought they 	were certain to keep better health there. And so it seems God sent 	me this message through your illness: ‘You are a fool. Who are you 	to think who would keep better health where? I keep people healthy 	or make them ill as I choose. Why don’t you understand this simple 	thing?’ Though I have now learnt this wisdom, I still think that 	it might be better for them to remain in South Africa. But now it 	seems that you, too, will have to remain there. I also think that, 	if Pragji is not ready to shoulder the responsibility or if the 	responsibility is beyond his capacity and if you cannot make any 	other arrangement, you cannot come. It would not be proper to close 	the paper at this time. The problems here will take care of 	themselves. Stay there without worrying about things here, and don’t 	feel unhappy that you cannot come. After all, you live there for 	public service and not for your own    
 happiness. Write to me regularly.
 All there of us are very well. We do plenty of spinning, of course. I now rotate the wheel with my foot and draw the thread with the right hand. Even otherwise, I wished to experiment on this spinning-wheel for the sake of Prabhudas. But now I have an additional reason for spinning on it, namely, that my left elbow needs rest. Mahadev spins yarn of 40 counts. Sardar makes envelopes from useless paper. It is in one such envelope that I intend to seal this letter.
 Ramdas is in this jail. He sees me sometimes. His health is all right. He is reading and studying at present. Nimu and the children are in the Ashram.
 Devdas is far away in Gorakhpur. He has been having fever for some days. But there is no cause for anxiety. The fever is now receding.
 Ba is in Sabarmati [jail] and Kantilibtech_36_footnotelibtech_37_footnotein Visapur [jail]. There are many others, too, in jail, but I need not mention them here. Did I tell you that Devdas is engaged to Rajaji’s daughterlibtech_38_footnotelibtech_39_footnote? The engagement was the result of the strong desire of them both. Because of the struggle, they have put off the marriage.
 A good many reforms are being introduced in the Ashram. By reforms I mean further measures of self-control.
 Personally, I never think as to when the struggle would end. Let it end when it will. For him who fights for Truth and with truthful means, victory and defeat are the same. That is, he always wins, though the victory may come now or in future.
Sardar and Mahadev send their blesseings.
 Blessings from
